"video_id","title","views","likes","publishedAt","tags","description","thumbnail_url"
"pUyKI13S-yY","We've Been Receiving Another WTF Radio Signal From an Object 1,000,000 LY Wide","121382","4591","2025-09-24T16:09:07Z","Astrum, space, astrum space, astrumspace, astronomy, astrophysics, science, physics, documentary, space documentary, science documentary, galaxy, galaxies, cosmology, universe, NASA, ESA, ORCs, odd radio circles, radio, radio astronomy, telescope, radio telescope, kapinska, mystery, EMU, cosmic, stellar, supernova, black holes, galactic, starburst, weird space, strange, unexplained, cosmos, new discovery, deep space, jet, jets, radio jet, agn, EMU project, supermassive, black hole, emission, spectrum, radio waves","The discovery of “Odd Radio Circles” in deep space has scientists stumped.  If you love learning about science as much as I do, head to http://brilliant.org/astrum to start for free. You'll also receive 20% off a premium annual subscription, giving you unlimited access to everything on Brilliant.  ▀▀▀▀▀▀  Astronomers are captivated by a new cosmic mystery: strange, glowing circles in space that defy all explanation. Known as ""Odd Radio Circles"", or ORCs, these colossal structures are a million light-years wide and are changing everything we thought we knew about the cosmos. In this video, we’re delving into the leading theories to explain where these giant rings came from.   ▀▀▀▀▀▀  0:00 WTF? 1:44 The EMU Project 4:32 Discovery 6:41 The First ORC  7:44 What Are ORCs? 10:41 Hypothesis 1: Cataclysmic Event 11:42 Hypothesis 2: Jets 12:48 Hypothesis 3: Starburst Termination Shock 14:03 More Circles 17:24 Cloverleaf ORC 20:03 Hypothesis 4: Galaxy Collision 21:16 The Search Continues   ▀▀▀▀▀▀  Astrum's newsletter has launched! Want to know what's happening in space?  Sign up here: https://astrumspace.kit.com   ▀▀▀▀▀▀   Astrum Displate Posters: https://astrumspace.info/Displates  Astrum Infographic Artwork: https://electrify.art/collections/astrum   Astrum Merch: https://astrum-shop.fourthwall.com/   Join us on the Astrum discord: https://discord.gg/TKw8Hpvtv8   A huge thanks to our Patreons who help make these videos possible. Sign-up here to support the channel: https://bit.ly/4aiJZNF   ▀▀▀▀▀▀  Astrum Podcast on Spotify: https://open.spotify.com/show/6jPRrbq3o3dpvBb173ZTKi?si=a90d3efe3b704c83   Astrum Earth: https://youtube.com/@astrumearth  Astrum Extra: https://www.youtube.com/@astrumextra   Astrum Spanish: https://www.youtube.com/@astrumespanol  Astrum Portuguese: https://www.youtube.com/channel/UChn_-OwvV63mr1yeUGvH-BQ   ▀▀▀▀▀▀  References: “Evolutionary Map of the Universe (EMU) survey science goals”, via emu-survey.org https://astrumspace.info/emusurvey  “Unexpected circular radio objects at high Galactic latitude”, via cambridge.org https://astrumspace.info/orc1  “Expect the unexpected from the big data boom in radio astronomy”, via theconversation.com https://astrumspace.info/askap  “What are odd radio circles (ORCs)?”, via spaceaustralia.com https://astrumspace.info/whatareorcs  “Origin scenarios for odd radio circles”, via arxiv.org https://astrumspace.info/orcorigins  “Discovery of a Cloverleaf-shaped odd radio circle”, via nature.com https://astrumspace.info/cloverleaforc  “Interpreting the Cloverleaf ORC: competing hypotheses”, via nature.com https://astrumspace.info/orchypothesis  “The galactic dance hypothesis for ORC formation”, via aanda.org https://astrumspace.info/orcgalacticmerger  “ASKAP reveals a supernova remnant”, via phys.org https://astrumspace.info/askapsupernova  “Zooniverse citizen science projects”, via zooniverse.org https://astrumspace.info/zooniverse   ▀▀▀▀▀▀  Credits: Writer: Michelle Babcock Video Editor: Frame Forge Researcher: Shourya Shrivastava Script Editor: Damaris McColgan Thumbnail Designer: Peter Sheppard Channel Manager: Georgina Brenner Production Manager: Raquel Taylor Head of Astrum: Jess Jordan Creator of Astrum: Alex McColgan  With special thanks to: NASA/ESO/ESA  #Astrum #Space #OddRadioCircles","https://i.ytimg.com/vi/pUyKI13S-yY/maxresdefault.jpg"
"Fh3Chax2Sw4","China's Zhurong Rover Found Evidence of Ancient Oceans on Mars","285920","9251","2025-09-17T18:04:54Z","Astrum, space, astrum space, astrumspace, astronomy, astrophysics, science, physics, documentary, space documentary, science documentary, earth, planet, planets, solar system, NASA, China, zhurong, rover, mars rover, mars, planet mars, red planet, ocean, mars ocean, ocean on mars, water, water on mars, discovery, Tianwen-1, Tianwen, china space, mission, Utopia Planitia, beach, shoreline, atmosphere, faint young sun, ancient, space agency, cnsa, evidence, chemistry, astrobiology","China’s Zhurong rover has found evidence of ancient oceans on Mars. Get NordVPN 2Y plan + 4 months extra ➼ https://nordvpn.com/astrum. It’s risk-free with Nord’s 30-day money-back guarantee!  ▀▀▀▀▀▀  Mars might once have had the most beautiful beaches in our solar system. For decades, the idea of ancient Martian oceans has been a theory, but now, a stunning new discovery has changed everything. The Zhurong rover has uncovered the first definitive proof of a long-lost ocean on Mars, complete with waves and tides. This discovery is fundamentally reshaping our understanding of the Red Planet, and could finally guide us to where we might find signs of life beyond Earth.  ▀▀▀▀▀▀  0:00 Did Mars Have Oceans? 1:44 Water on Mars 4:21 The Zhurong Rover Mission 10:57 Zhurong’s Discovery 13:27 Faint Young Sun Paradox 16:38 Return to Mars  ▀▀▀▀▀▀  Astrum's newsletter has launched! Want to know what's happening in space?  Sign up here: https://astrumspace.kit.com   ▀▀▀▀▀▀   Astrum Displate Posters: https://astrumspace.info/Displates  Astrum Infographic Artwork: https://electrify.art/collections/astrum   Astrum Merch: https://astrum-shop.fourthwall.com/   Join us on the Astrum discord: https://discord.gg/TKw8Hpvtv8   A huge thanks to our Patreons who help make these videos possible. Sign-up here to support the channel: https://bit.ly/4aiJZNF   ▀▀▀▀▀▀  Astrum Podcast on Spotify: https://open.spotify.com/show/6jPRrbq3o3dpvBb173ZTKi?si=a90d3efe3b704c83   Astrum Earth: https://youtube.com/@AstrumEarth  Astrum Extra: https://www.youtube.com/@astrumextra   Astrum Spanish: https://www.youtube.com/@astrumespanol  Astrum Portuguese: https://www.youtube.com/channel/UChn_-OwvV63mr1yeUGvH-BQ   ▀▀▀▀▀▀  References: “Evidence of subsurface ice deposits on Mars”, via science.org https://astrumspace.info/marswaterice  “Stable surface water on the Red Planet”, via astro.dur.ac.uk https://astrumspace.info/stablewater  “South pole water detection confirmed by spectrometer”, via science.org https://astrumspace.info/marssouthpole  “Exploring Utopia Planitia’s hidden landscape”, via spacenews.com https://astrumspace.info/utopiaplanitia  “Mapping the distribution of Martian ice reserves”, via pmc.ncbi.nlm.nih.gov https://astrumspace.info/marsiceglobal  “Ancient ocean basins revealed by Martian radar data”, via pnas.org https://astrumspace.info/marsoceans  “Radar hints at sandy shorelines of a Martian ocean”, via theguardian.com https://astrumspace.info/marsbeaches  “What’s happened to China’s first Mars rover?”, via nature.com https://astrumspace.info/marsroverfail  “Buried ice found in Mars’ scalloped terrain”, via nasa.gov https://astrumspace.info/marsburiedice  “China targets 2028 launch for Tianwen-3 sample return”, via cgtn.com https://astrumspace.info/tianwen3   ▀▀▀▀▀▀  Credits: Writer: Julia Masselos Video Editor: Suhith Researcher: Shourya Shrivastava Script Editor: Damaris McColgan Thumbnail Designer: Peter Sheppard Channel Manager: Georgina Brenner Production Manager: Raquel Taylor Head of Astrum: Jess Jordan Creator of Astrum: Alex McColgan  With special thanks to: NASA/ESO/ESA  #Astrum #Space #Mars #MarsOcean","https://i.ytimg.com/vi/Fh3Chax2Sw4/maxresdefault.jpg"
"tu4cpaDZ68g","First Ever Images from the Vera Rubin Telescope","1129889","29761","2025-09-10T16:05:17Z","Astrum, space, astrum space, astrumspace, astronomy, astrophysics, science, physics, documentary, space documentary, science documentary, star, stars, galaxy, galaxies, vera rubin, vera c rubin, rubin, telescope, observatory, hubble, james webb, jwst, images, photos, photo, asteroid, asteroids, discovery, discover, discovered, milky way, cluster, virgo, treasure chest, Cosmic Treasure Chest, cosmos, cosmology, mosaic, dark matter, supernova, supernovae, nebula, nebulae, survey, galaxy cluster, first images","The Vera C. Rubin telescope has just released its first images, and they’re spectacular.   If you love learning about science as much as I do, head to http://brilliant.org/astrum to start for free. You'll also receive 20% off a premium annual subscription, giving you unlimited access to everything on Brilliant.  ▀▀▀▀▀▀  On a mountain in Chile, the Vera C. Rubin Observatory, with its massive 3.2-billion-pixel camera, is capturing images that rival those from the James Webb Space Telescope. Get ready to see some of the most stunning astronomical images ever taken as we explore how this groundbreaking project will help us unlock the secrets of the universe. This is just the beginning.   ▀▀▀▀▀▀  Astrum's newsletter has launched! Want to know what's happening in space?  Sign up here: https://astrumspace.kit.com   ▀▀▀▀▀▀   Astrum Displate Posters: https://astrumspace.info/Displates  Astrum Infographic Artwork: https://electrify.art/collections/astrum   Astrum Merch: https://astrum-shop.fourthwall.com/   Join us on the Astrum discord: https://discord.gg/TKw8Hpvtv8   A huge thanks to our Patreons who help make these videos possible. Sign-up here to support the channel: https://bit.ly/4aiJZNF   ▀▀▀▀▀▀  Astrum Podcast on Spotify: https://open.spotify.com/show/6jPRrbq3o3dpvBb173ZTKi?si=a90d3efe3b704c83   Astrum Earth: https://youtube.com/@AstrumEarth  Astrum Extra: https://www.youtube.com/@astrumextra   Astrum Spanish: https://www.youtube.com/@astrumespanol  Astrum Portuguese: https://www.youtube.com/channel/UChn_-OwvV63mr1yeUGvH-BQ   ▀▀▀▀▀▀  References: “Waiting for first light”, via mos.org https://astrumspace.info/firstlight  “First imagery from Rubin”, via rubinobservatory.org  https://astrumspace.info/rubinimagery  “About Vera Rubin”, via rubinobservatory.org https://astrumspace.info/verarubin  “How Rubin works”, via rubinobservatory.org https://astrumspace.info/rubinworks  “Rubin Observatory optical design”, via lsst.org https://astrumspace.info/opticaldesign  “The Legacy Survey of Space and Time (LSST)”, via rubinobservatory.org https://astrumspace.info/lsst  “Groundbreaking Vera Rubin Observatory revealed”, via phys.org https://astrumspace.info/rubinobs  “The Cosmic Treasure Chest - 10 million galaxies ”, via rubinobservatory.org https://astrumspace.info/gallery1  “Cosmic Abundance - Virgo Cluster”, via rubinobservatory.org https://astrumspace.info/gallery2  “Cosmic Drama - Virgo Cluster”, via rubinobservatory.org https://astrumspace.info/gallery3  “Rhythms in the Stars - RR Lyrae variables”, via rubinobservatory.org https://astrumspace.info/maingallery   ▀▀▀▀▀▀  Credits: Writer: Michelle Babcock Video Editor: Nathália Huzian Researcher: Shourya Shrivastava Script Editor: Damaris McColgan Thumbnail Designer: Peter Sheppard Channel Manager: Georgina Brenner Production Manager: Raquel Taylor Head of Astrum: Jess Jordan Creator of Astrum: Alex McColgan  #Astrum #Space #VeraRubinTelescope","https://i.ytimg.com/vi/tu4cpaDZ68g/maxresdefault.jpg"
"spw7nv79L5o","The End of NASA Is Coming","213325","17007","2025-09-04T16:01:37Z","Astrum, space, astrum space, astronomy, astrophysics, science, physics, documentary, space documentary, earth, planets, stars, solar system, sun, NASA, space mission, juno, NASA budget cuts, trump, donald trump, president, usa, america, united states, SpaceX, Elon Musk, Mars, Pluto, Jupiter, ISS, Artemis, Starlink, New Horizons, James Webb, Hubble, space exploration, future of space, space news, space tourism, Mars Odyssey, private space, Blue Origin, bezos, agency, space agency, space travel, mission","NASA is on the brink of an extinction-level event.  Go to https://groundnews.com/astrum to stay fully informed on the latest Space and Science news. Save 40% off through our link for unlimited access to the Vantage plan this month.  ▀▀▀▀▀▀  The future of NASA is changing. A proposed budget cut, the largest in the space program’s history, threatens to cancel missions and gut decades of progress. What happens when the world's leader in space exploration is brought to its knees? Join us as we investigate the shocking truth behind the cuts and the private companies waiting to fill the void.  ▀▀▀▀▀▀  0:00 Is This the End of NASA? 1:42 The Budget Cuts and Their Impact 13:42 Space Privatization 20:53 The Future of Space Exploration  ▀▀▀▀▀▀  Astrum's newsletter has launched! Want to know what's happening in space?  Sign up here: https://astrumspace.kit.com   ▀▀▀▀▀▀   Astrum Displate Posters: https://astrumspace.info/Displates  Astrum Infographic Artwork: https://electrify.art/collections/astrum   Astrum Merch: https://astrum-shop.fourthwall.com/   Join us on the Astrum discord: https://discord.gg/TKw8Hpvtv8   A huge thanks to our Patreons who help make these videos possible. Sign-up here to support the channel: https://bit.ly/4aiJZNF   ▀▀▀▀▀▀  Astrum Podcast on Spotify: https://open.spotify.com/show/6jPRrbq3o3dpvBb173ZTKi?si=a90d3efe3b704c83   Astrum Earth: https://youtube.com/@AstrumEarth  Astrum Extra: https://www.youtube.com/@astrumextra   Astrum Spanish: https://www.youtube.com/@astrumespanol  Astrum Portuguese: https://www.youtube.com/channel/UChn_-OwvV63mr1yeUGvH-BQ   ▀▀▀▀▀▀  References:  “NASA 2026 Budget Proposal in Charts”, via planetary.org https://astrumspace.info/trump_plan “The Missions NASA May Be Forced to Abandon”, via planetary.org https://astrumspace.info/budget_cuts “Space Under Threat”, via universemagazine.com https://astrumspace.info/nasa_future “NASA Artemis Programme”, via nasa.gov https://astrumspace.info/artimis “Budget Impact on Prospects of Space Exploration”, via satnews.com https://astrumspace.info/budget_impact “SpaceX Targeting Record-Breaking 170 Orbital Launches in 2025”, via aiaa.org https://astrumspace.info/spacex_launches “US Pays SpaceX, Blue Origin, ULS $1.4B for Space Defence”, via satellitetoday.com https://astrumspace.info/space_funding “NASA Contributions to Science”, via nasa.gov https://astrumspace.info/nasa_importance “What’s in NATO’s First-Ever Commercial Space Strategy”, via atlanticcouncil.org https://astrumspace.info/nato_space “Every Living Former NASA Science Chief Opposes Trump’s Proposed Budget Cuts” via planetary.org https://astrumspace.info/opposition  ▀▀▀▀▀▀  Credits: Writer: Julia Masselos Video Editor: Nick Shishkin Researcher: Shourya Shrivastava Script Editor: Damaris McColgan Thumbnail Designer: Peter Sheppard Channel Manager: Georgina Brenner Production Manager: Raquel Taylor Head of Astrum: Jess Jordan Creator of Astrum: Alex McColgan  With special thanks to: NASA/ESO/ESA  #Astrum #Space #NASACuts","https://i.ytimg.com/vi/spw7nv79L5o/maxresdefault.jpg"
"rL6uo5FRnKY","What If Black Holes Aren't the Weirdest Objects in Space?","446409","9957","2025-08-29T16:01:41Z","Astrum, space, astrum space, astrumspace, astronomy, astrophysics, science, physics, universe, documentary, space documentary, science documentary, black hole, white hole, blackhole, black holes, white holes, gravastar, gravastars, exotic stars, dark energy, dark matter, neutron star, LIGO, event horizon, quantum, theoretical physics, wormhole, worm hole, spacetime, Einstein, general relativity, singularity, parallel universe, paradox, multiverse, universes, quantum gravity, big bang, big crunch","In this Supercut, we’re delving into the universe's most mind-bending theoretical concepts. Are these just theories, or could they exist in our universe? Click this link https://boot.dev/?promo=ASTRUM and use my code ASTRUM to get 25% off your first payment for boot.dev  ▀▀▀▀▀▀  Join us as we explore unproven hypotheses in physics, from exotic stars and strange forms of matter, to the structure of the universe itself. Just as black holes were once mere speculation, these unseen phenomena might be awaiting discovery. Prepare for a captivating journey through the paradigm-shifting ideas that could reshape our understanding of reality.   ▀▀▀▀▀▀  0:00 Proving the Unproven 1:59 The Weirdest Star in the Universe 17:48 The Opposite of a Black Hole 32:54 Was Our Universe a Coincidence? 44:21 How Many Universes Are There?  ▀▀▀▀▀▀  Astrum's newsletter has launched! Want to know what's happening in space?  Sign up here: https://astrumspace.kit.com   ▀▀▀▀▀▀   Astrum Displate Posters: https://astrumspace.info/Displates  Astrum Infographic Artwork: https://electrify.art/collections/astrum   Astrum Merch: https://astrum-shop.fourthwall.com/   Join us on the Astrum discord: https://discord.gg/TKw8Hpvtv8   A huge thanks to our Patreons who help make these videos possible. Sign-up here to support the channel: https://bit.ly/4aiJZNF   ▀▀▀▀▀▀  Astrum Podcast on Spotify: https://open.spotify.com/show/6jPRrbq3o3dpvBb173ZTKi?si=a90d3efe3b704c83   Astrum Earth: https://youtube.com/@AstrumEarth  Astrum Extra: https://www.youtube.com/@astrumextra   Astrum Spanish: https://www.youtube.com/@astrumespanol  Astrum Portuguese: https://www.youtube.com/channel/UChn_-OwvV63mr1yeUGvH-BQ   ▀▀▀▀▀▀  Credits: Writer: Jon McColgan, David Shlivko Video Editor: Nathália Huzian, André Rodrigues Script Editor: Damaris McColgan Thumbnail Designer: Peter Sheppard Channel Manager: Georgina Brenner Production Manager: Raquel Taylor Head of Astrum: Jess Jordan Creator of Astrum: Alex McColgan  With special thanks to: NASA/ESO/ESA  #astrum #space #universe #unproven","https://i.ytimg.com/vi/rL6uo5FRnKY/maxresdefault.jpg"
"ZTX64qW_LK0","Why Polaris Is the Most Confusing Star in the Sky","395489","13174","2025-08-25T16:01:01Z","Astrum, space, astrum space, astrumspace, astronomy, astrophysics, science, physics, documentary, space documentary, science documentary, earth, stars, star, galaxy, solar system, sun, NASA, ESA, polaris, north star, northstar, cepheid, cepheid variable, standard candle, stellar, binary, triple, triple star, star system, polaris aa, polaris b, polaris ab, Leavitt, henrietta Leavitt, Magellanic Cloud, parallax, giant star, supergiant star, dwarf star, stellar evolution, centauri, navigation","The problem with Polaris, the North Star.  Get a special 35% discount* on an annual digital subscription to The Economist at https://www.economist.com/Astrum *20% in the UK, Latin America, and India. Referenced article: https://www.economist.com/science-and-technology/2025/08/06/astronomers-cannot-agree-on-how-fast-the-universe-is-expanding   ▀▀▀▀▀▀  For centuries, we've relied on the North Star to guide us across the Earth. A static, bright beacon in the northern sky, Polaris serves as a reliable method of navigation… or does it? This star proves far more challenging to study than it initially appears. From its distance, to its secret companions, we’re unravelling the mysteries of Polaris - mysteries that only grow stranger the closer we look.  ▀▀▀▀▀▀  0:00 The Problem with Polaris 1:04 Finding the North Star 2:08 Triple Star System 4:36 Cepheids: Standard Candles 6:34 Polaris Aa Is Weird 11:54 Are Our Models Wrong? 16:06 The Age Paradox 18:18 Polaris Won't Be the North Star Forever  ▀▀▀▀▀▀  Astrum's newsletter has launched! Want to know what's happening in space?  Sign up here: https://astrumspace.kit.com   ▀▀▀▀▀▀   Astrum Displate Posters: https://astrumspace.info/Displates  Astrum Infographic Artwork: https://electrify.art/collections/astrum   Astrum Merch: https://astrum-shop.fourthwall.com/   Join us on the Astrum discord: https://discord.gg/TKw8Hpvtv8   A huge thanks to our Patreons who help make these videos possible. Sign-up here to support the channel: https://bit.ly/4aiJZNF   ▀▀▀▀▀▀  Astrum Podcast on Spotify: https://open.spotify.com/show/6jPRrbq3o3dpvBb173ZTKi?si=a90d3efe3b704c83   Astrum Earth: https://youtube.com/@AstrumEarth  Astrum Extra: https://www.youtube.com/@astrumextra   Astrum Spanish: https://www.youtube.com/@astrumespanol  Astrum Portuguese: https://www.youtube.com/channel/UChn_-OwvV63mr1yeUGvH-BQ   ▀▀▀▀▀▀  References: “Origin of Strange 'Blue Straggler' Stars Pinned Down”, via space.com https://astrumspace.info/bluestraggler  “Hubble Space Telescope Trigonometric Parallax of Polaris B”, via iop.org https://astrumspace.info/companionstar  “Probing Polaris”, via eso.org https://astrumspace.info/probingpolaris  “Finding magnetic north: an extraordinary magnetic field detection in Polaris and first results of a magnetic survey of classical Cepheids”, via ras.ac.uk https://astrumspace.info/polarismagneticnorth  “Astronomers Find Spots on Surface of Polaris”, via sci.news https://astrumspace.info/sunspots  “Toward Ending the Polaris Parallax Debate: A Precise Distance to Our Nearest Cepheid from Gaia DR”, via iop.org https://astrumspace.info/polarisdistance  “The Period Change of the Cepheid Polaris Suggests Enhanced Mass Loss”, via iop.org https://astrumspace.info/unstablephase  “The Period Changes of Polaris”, via jstor.org https://astrumspace.info/periodincrease  “Precise Radial Velocities of Polaris: Detection of Amplitude Growth”, via iop.org https://astrumspace.info/Cepheidamplitude  “Periods of 25 Variable Stars in the Small Magellanic Cloud”, via harvard.edu https://astrumspace.info/Cepheidrelationship   ▀▀▀▀▀▀  Credits: Writer: Julia Masselos Video Editor: Nick Shishkin Researcher: Edie Abrahams Script Editor: Damaris McColgan Thumbnail Designer: Peter Sheppard Channel Manager: Georgina Brenner Production Manager: Raquel Taylor Head of Astrum: Jess Jordan Creator of Astrum: Alex McColgan  With special thanks to: NASA/ESO/ESA  #astrum #space #polaris #northstar","https://i.ytimg.com/vi/ZTX64qW_LK0/maxresdefault.jpg"
