"video_id","title","views","likes","publishedAt","tags","description","thumbnail_url"
"Ln69789fGoQ","The Speed of Light Reveals the Universe Must Be Stranger Than We Ever Imagined","1002061","26713","2023-01-02T18:35:12Z","speed of light, physics, einstein, light speed, science, why is the speed of light the limit, can we travel at speed of light, how to travel at speed of light, special relativity, astrophysics, faster than speed of light, faster than light, faster than the speed of light, light speed travel, albert einstein, relativity, speed of light explained, theory of relativity, faster than light speed, general relativity, why is light speed constant, special relativity explained, time","Why doesn't anything go faster than the speed of light? Want to see the world through the eyes of a scientist? Visit https://brilliant.org/astrum to sample their courses for free, and the first 200 of you will get 20% off Brilliant's annual premium subscription.  Previous episodes: https://www.youtube.com/watch?v=tv3UrO2gHxQ&list=PL2gLpWRK0QlAxUUfLtFIGWauzb-c1vE4g  Astrum merch now available!  Apparel: https://astrum-shop.fourthwall.com/ Metal Posters: https://displate.com/promo/astrum?art=5f04759ac338b  SUBSCRIBE for more videos about our other planets. Subscribe! http://goo.gl/WX4iMN Facebook! http://goo.gl/uaOlWW Twitter! http://goo.gl/VCfejs  Astrum Spanish: https://bit.ly/2KmkssR Astrum Portuguese: https://www.youtube.com/channel/UChn_-OwvV63mr1yeUGvH-BQ  Donate!  Patreon: http://goo.gl/GGA5xT Ethereum Wallet: 0x5F8cf793962ae8Df4Cba017E7A6159a104744038  Become a Patron today and support my channel! Donate link above. I can't do it without you. Thanks to those who have supported so far!  #speedoflight #theunseenuniverse #astrum","https://i.ytimg.com/vi/Ln69789fGoQ/maxresdefault.jpg"
"yVAwc7SxpWk","How the River Delta And Lake on Mars Came to Be | Perseverance Part 5","257497","7501","2022-12-26T19:25:41Z","perseverance, perseverance rover, nasa, perseverance nasa, perseverance mars, astrum, astrumspace, ingenuity, ingenuity helicopter, mars rover, mars, jpl, mars 2020, nasa perseverance, mars latest images, perseverance news, mars 2022, mars exploration, mars surface, mars new photos, red planet, planet mars, mars odyssey, mars helicopter, mars perseverance, mars news, mars new images, space, perseverence, water on mars, rover, 4k, update, mission, photos","NASA Perseverance's close call with Ingenuity and the start of the trip to Jezero crater. Visit https://brilliant.org/astrum to sample their courses for free, and the first 200 of you will get 20% off Brilliant's annual premium subscription.  Astrum merch now available!  Apparel: https://astrum-shop.fourthwall.com/ Metal Posters: https://displate.com/promo/astrum?art=5f04759ac338b  SUBSCRIBE for more videos about our other planets. Subscribe! http://goo.gl/WX4iMN Facebook! http://goo.gl/uaOlWW Twitter! http://goo.gl/VCfejs Instagram! https://www.instagram.com/astrumspace/ TikTok! https://www.tiktok.com/@astrumspace  Astrum Spanish: https://bit.ly/2KmkssR Astrum Portuguese: https://www.youtube.com/channel/UChn_-OwvV63mr1yeUGvH-BQ  Donate!  Patreon: http://goo.gl/GGA5xT Ethereum Wallet: 0x5F8cf793962ae8Df4Cba017E7A6159a104744038  Become a Patron today and support my channel! Donate link above. I can't do it without you. Thanks to those who have supported so far!  Music credit: Pond5, Stellardrone, Meydän  #perseverance #nasa #mars #astrum #ingenuity","https://i.ytimg.com/vi/yVAwc7SxpWk/maxresdefault.jpg"
"LU89w5GVOas","Why Voyager 1 Is Talking in Gibberish","805687","28071","2022-12-22T16:33:43Z","voyager, voyager i, voyager 1, garbled signals, what voyager i saw, astrum, astrumspace, nasa, space, edge of the solar system, interstellar space","What caused Voyager I to send this weird message? 🌏 Get Exclusive NordVPN deal here ➼ https://nordvpn.com/astrum It's risk-free with Nord's 30-day money-back guarantee! ✌  Astrum merch now available!  Apparel: https://astrum-shop.fourthwall.com/ Metal Posters: https://displate.com/promo/astrum?art=5f04759ac338b  SUBSCRIBE for more videos about our other planets. Subscribe! http://goo.gl/WX4iMN Facebook! http://goo.gl/uaOlWW Twitter! http://goo.gl/VCfejs Instagram! https://www.instagram.com/astrumspace/ TikTok! https://www.tiktok.com/@astrumspace  Astrum Spanish: https://bit.ly/2KmkssR Astrum Portuguese: https://www.youtube.com/channel/UChn_-OwvV63mr1yeUGvH-BQ  Donate!  Patreon: http://goo.gl/GGA5xT Ethereum Wallet: 0x5F8cf793962ae8Df4Cba017E7A6159a104744038  Become a Patron today and support my channel! Donate link above. I can't do it without you. Thanks to those who have supported so far!  #voyager1 #nasa #voyager   Image Credits: NASA/ESO/ESA","https://i.ytimg.com/vi/LU89w5GVOas/sddefault.jpg"
"LmkRrtfY6VI","At Last! NASA Found What it Was Looking For on Mars | InSight Probe Supercut","1963801","25408","2022-12-19T12:33:18Z","insight, nasa, insight movie, insight mars, mars, what insight saw on mars, insight lander, marsquakes, insight landing, mars insight, nasa insight, insight mission, nasa mars, mars landing, mars insight lander, mars exploration, nasa insight lander, mars images, mars lander, mars mission, mission to mars, landing on mars, nasa news, mars latest images, insight mars lander, marsquake, nasa insight mars, jet propulsion laboratory, mars surface, mars new photos, red planet","The entire InSight mission from start to finish, plus everything it discovered. NEW Displate Posters: https://displate.com/promo/astrum?art=5f04759ac338b  SUBSCRIBE for more videos about our other planets. Subscribe! http://goo.gl/WX4iMN Facebook! http://goo.gl/uaOlWW Twitter! http://goo.gl/VCfejs Instagram! https://www.instagram.com/astrumspace/ TikTok! https://www.tiktok.com/@astrumspace  Astrum Spanish: https://bit.ly/2KmkssR Astrum Portuguese: https://www.youtube.com/channel/UChn_-OwvV63mr1yeUGvH-BQ  Donate!  Patreon: http://goo.gl/GGA5xT Ethereum Wallet: 0x5F8cf793962ae8Df4Cba017E7A6159a104744038  Become a Patron today and support my channel! Donate link above. I can't do it without you. Thanks to those who have supported so far!  #insight #nasa #astrum   A New Beginning (Inspirational Ambient Cinematic Background) - SolidSoundMusic Cinematic Ambient Piano - BlackSunAeon_Music Ambient Calm Technology Medcine Science Documentary Background - mv_production Long Calm Inspiring Ambient - Tech Science Info Guide - mv_production Calm Piano Ambient - Indigoseeds Mountainscape (No Vocals) - Humans Win Snowflake - Borrtex  InSight is a mission to study the interior of Mars. Learn more about the mission and its goals in this complete saga.  In this video, we'll take you through the entire history of InSight, from the launch of the mars Insight lander to the success of the mission so far. We'll cover everything you need to know about this exciting mission to Mars!","https://i.ytimg.com/vi/LmkRrtfY6VI/maxresdefault.jpg"
"Azf30mBzXZM","Water Behaving Strangely","3041417","108796","2022-12-17T17:00:15Z","wave, wave machine, wave machines, water science, science experiments, water science experiment, astrum, astrumspace, space, wave movement, physics, wave motion, waves, generated waves, wave energy, generated water wave, energy, ocean, science shorts, shorts, science, experiment, youtube shorts, best shorts, factual shorts, facts, amazing facts, physics shorts, learn with shorts, science facts, incredible science facts, interesting science facts","#shorts What do you think happens when waves meet their identical counterpart? Stay until the end to find out! NEW! Displates: https://displate.com/promo/astrum?art=5f04759ac338b  SUBSCRIBE for more videos about our other planets. Subscribe! http://goo.gl/WX4iMN Facebook! http://goo.gl/uaOlWW Twitter! http://goo.gl/VCfejs Instagram! https://www.instagram.com/astrumspace/ TikTok! https://www.tiktok.com/@astrumspace  Astrum Spanish: https://bit.ly/2KmkssR Astrum Portuguese: https://www.youtube.com/channel/UChn_-OwvV63mr1yeUGvH-BQ  Donate!  Patreon: http://goo.gl/GGA5xT Ethereum Wallet: 0x5F8cf793962ae8Df4Cba017E7A6159a104744038  Become a Patron today and support my channel! Donate link above. I can't do it without you. Thanks to those who have supported so far!   #sciencefacts #waterexperiment #Astrum","https://i.ytimg.com/vi/Azf30mBzXZM/maxresdefault.jpg"
"01aFP88qfQs","What Milankovitch Cycles Will Do To Earth","3763661","77629","2022-12-15T16:37:38Z","milankovitch cycles, earth, explanation of milankovitch cycles, milankovitch cycles ice age, ice ages, axial tilt, eccentricity, milankovitch, milankovic, precession of the equinox, climate change and the milankovitch cycles, nasa, astrum, astrumspace, milutin milankovitch, glaciation, aphelion, perihelion, ellipse, global temperature, climate cycles, axial precession, climate change, earth's wobble, what causes ice age, orbital parameters, global cooling","Earth's orbit is constantly evolving through Milankovitch Cycles. Try Speakly for free for 7 days, and get a 60% discount if you join the annual subscription: https://speakly.app.link/Speakly  Astrum merch now available!  Apparel: https://astrum-shop.fourthwall.com/ Metal Posters: https://displate.com/promo/astrum?art=5f04759ac338b  SUBSCRIBE for more videos about our other planets. Subscribe! http://goo.gl/WX4iMN Facebook! http://goo.gl/uaOlWW Twitter! http://goo.gl/VCfejs Instagram! https://www.instagram.com/astrumspace/ TikTok! https://www.tiktok.com/@astrumspace  Astrum Spanish: https://bit.ly/2KmkssR Astrum Portuguese: https://www.youtube.com/channel/UChn_-OwvV63mr1yeUGvH-BQ  Donate!  Patreon: http://goo.gl/GGA5xT Ethereum Wallet: 0x5F8cf793962ae8Df4Cba017E7A6159a104744038  Become a Patron today and support my channel! Donate link above. I can't do it without you. Thanks to those who have supported so far!  #milankovitchcycles #astrum #iceage","https://i.ytimg.com/vi/01aFP88qfQs/maxresdefault.jpg"
"-sKrsPv7X8I","The Tragic Final Moments of NASA's Cassini","5090968","214630","2022-12-14T18:13:26Z","cassini, nasa, grand finale, cassini saturn, cassini nasa, saturn, cassini photos, cassini grand finale, cassini probe, cassini mission, cassini spacecraft, when did cassini crash into saturn, where is cassini now, sacrifice of cassini, cosmos: possible worlds: the sacrifice of cassini, jpl, did cassini dive into saturn, did cassini survive, what did cassini photograph, cassini's fatal crash, nasa cassini, death dive into saturn, saturn atmosphere, cassini last video, nasa jpl","#shorts Everything the NASA Cassini probe did during its final few minutes before it burned up in Saturn's atmosphere. NEW! Displates: https://displate.com/promo/astrum?art=5f04759ac338b  SUBSCRIBE for more videos about our other planets. Subscribe! http://goo.gl/WX4iMN Facebook! http://goo.gl/uaOlWW Twitter! http://goo.gl/VCfejs Instagram! https://www.instagram.com/astrumspace/ TikTok! https://www.tiktok.com/@astrumspace  Astrum Spanish: https://bit.ly/2KmkssR Astrum Portuguese: https://www.youtube.com/channel/UChn_-OwvV63mr1yeUGvH-BQ  Donate!  Patreon: http://goo.gl/GGA5xT Ethereum Wallet: 0x5F8cf793962ae8Df4Cba017E7A6159a104744038  Become a Patron today and support my channel! Donate link above. I can't do it without you. Thanks to those who have supported so far!   #physics #momentum #Astrum","https://i.ytimg.com/vi/-sKrsPv7X8I/maxresdefault.jpg"
"iogVVja1MYY","The Gravity Illusion","9070150","173375","2022-12-10T17:00:23Z","momentum, science, science experiments, science experiment, acceleration, acceleration physics, what is acceleration, astrum, astrumspace, space, physics, balls on a ramp, ramp, science facts, interesting science facts, gravity, illusion, illusions, optical illusion, optical illusions, learn, learn science, gravity momentum, gravity acceleration, science illusions, learn gravity, gravitational force, speed, shorts, youtube shorts, science shorts, experiment, space shorts, physics shorts","#shorts The results of this simple experiment may surprise you. We have two different ramps that a metal ball can roll down. Stay until the end to see which metal ball made it down the fastest.  Astrum merch now available! Apparel: https://teespring.com/stores/astrum-space  Metal Posters: https://displate.com/promo/astrum?art=5f04759ac338b  SUBSCRIBE for more videos about our other planets. Subscribe! http://goo.gl/WX4iMN Facebook! http://goo.gl/uaOlWW Twitter! http://goo.gl/VCfejs Instagram! https://www.instagram.com/astrumspace/ TikTok! https://www.tiktok.com/@astrumspace  Astrum Spanish: https://bit.ly/2KmkssR Astrum Portuguese: https://www.youtube.com/channel/UChn_-OwvV63mr1yeUGvH-BQ  Donate!  Patreon: http://goo.gl/GGA5xT Ethereum Wallet: 0x5F8cf793962ae8Df4Cba017E7A6159a104744038  Become a Patron today and support my channel! Donate link above. I can't do it without you. Thanks to those who have supported so far!   #physics #momentum #Astrum","https://i.ytimg.com/vi/iogVVja1MYY/maxresdefault.jpg"
"nGRGUZ6HQYs","OSIRIS-Rex Touchdown on Bennu Scared NASA Scientists, Luckily They Planned For Everything","878936","23106","2022-12-08T16:44:25Z","bennu, nasa, osirisrex, osiris rex, asteroid bennu, osiris-rex, 101955 bennu, bennu asteroid, bennu asteroid collision, sample return, science, space, osiris rex bennu, osiris-rex nasa, asteroid bennu nasa, osiris rex nasa, osiris-rex bennu, osiris-rex mission to asteroid bennu, bennu asteroid nasa, nightingale crater, sample collection, bennu osiris rex, osiris rex mission, what has osiris rex discovered so far, bennu landing, osiris rex landing, nasa bennu, bennu touchdown","When OSIRIS-REx took a sample from the Nightingale Crater on the Bennu asteroid. Sponsored by Ridge Wallet. Use the link https://ridge.com/astrum/ to get the best offer of up to 40% off until Dec 22nd.  Astrum merch now available!  Apparel: https://astrum-shop.fourthwall.com/ Metal Posters: https://displate.com/promo/astrum?art=5f04759ac338b  SUBSCRIBE for more videos about our other planets. Subscribe! http://goo.gl/WX4iMN Facebook! http://goo.gl/uaOlWW Twitter! http://goo.gl/VCfejs Instagram! https://www.instagram.com/astrumspace/ TikTok! https://www.tiktok.com/@astrumspace  Astrum Spanish: https://bit.ly/2KmkssR Astrum Portuguese: https://www.youtube.com/channel/UChn_-OwvV63mr1yeUGvH-BQ  Donate!  Patreon: http://goo.gl/GGA5xT Ethereum Wallet: 0x5F8cf793962ae8Df4Cba017E7A6159a104744038  Become a Patron today and support my channel! Donate link above. I can't do it without you. Thanks to those who have supported so far!  #osirisrex #bennu #nasa #astrum","https://i.ytimg.com/vi/nGRGUZ6HQYs/maxresdefault.jpg"
"y4Nbyopwvww","If There's a Ring Around the Sun, Find Shelter","410174","14665","2022-12-05T13:12:12Z","caught on camera, strangest things, ice halo, sundog, lunar halo, circumzenithal arc, astrum, astrumspace, incredible moments caught on camera, blow your mind, moments caught on camera, parhelia, parhelion, mind blowing, incredible moments, atmospheric phenomena, if it were not filmed, perseverance rover, mars latest images, space discoveries, incredible things, best videos, top 10, the most, interesting facts, unbelievable, best of the month, cool videos, strange, mars news","Everything about sundogs, lunar halos, ice halos, parhelia, and circumzenithal arcs. Sponsored by Ridge Wallet. Use the link https://ridge.com/astrum/ to get the best offer of up to 40% off until Dec 22nd.  Series playlist: https://www.youtube.com/watch?v=A-SZryVqFHo&list=PL2gLpWRK0QlCi0e15WWp4ZNhb-9TgD3of  Astrum merch now available!  Apparel: https://astrum-shop.fourthwall.com/ Metal Posters: https://displate.com/promo/astrum?art=5f04759ac338b  SUBSCRIBE for more videos about our other planets. Subscribe! http://goo.gl/WX4iMN Facebook! http://goo.gl/uaOlWW Twitter! http://goo.gl/VCfejs Instagram! https://www.instagram.com/astrumspace/ TikTok! https://www.tiktok.com/@astrumspace  Astrum Spanish: https://bit.ly/2KmkssR Astrum Portuguese: https://www.youtube.com/channel/UChn_-OwvV63mr1yeUGvH-BQ  Donate!  Patreon: http://goo.gl/GGA5xT Ethereum Wallet: 0x5F8cf793962ae8Df4Cba017E7A6159a104744038  Become a Patron today and support my channel! Donate link above. I can't do it without you. Thanks to those who have supported so far!  #icehalo #astrum #sundog   In this video, we'll explore what causes the mysterious anti-rainbows that can be seen occasionally in the sky.  We'll be looking at the circumzenithal arc, the sundog, and the parhelion, and learn what causes each one. We'll also see how to photograph and capture these beautiful phenomena in the sky!","https://i.ytimg.com/vi/y4Nbyopwvww/maxresdefault.jpg"
"7BVDfYM67I4","The Most Difficult Planet to Orbit","126473","7427","2022-11-26T16:00:02Z","mercury, planet mercury, mercury planet, messenger, nasa, solar wind, what is solar wind, solar winds, solar wind definition, the sun, solar system, solar system planets, space facts, facts about space, facts about our solar system, nasa messenger, astrum, astrumspace, space","#shorts Messenger made use of the stream of electrons, protons, and alpha-particles that the sun constantly emits to slow down its velocity. But, what was it that made it possible? Stay tuned to find out.  Astrum merch now available! Apparel: https://teespring.com/stores/astrum-space  Metal Posters: https://displate.com/promo/astrum?art=5f04759ac338b  SUBSCRIBE for more videos about our other planets. Subscribe! http://goo.gl/WX4iMN Facebook! http://goo.gl/uaOlWW Twitter! http://goo.gl/VCfejs Instagram! https://www.instagram.com/astrumspace/ TikTok! https://www.tiktok.com/@astrumspace  Astrum Spanish: https://bit.ly/2KmkssR Astrum Portuguese: https://www.youtube.com/channel/UChn_-OwvV63mr1yeUGvH-BQ  Donate!  Patreon: http://goo.gl/GGA5xT Ethereum Wallet: 0x5F8cf793962ae8Df4Cba017E7A6159a104744038  Become a Patron today and support my channel! Donate link above. I can't do it without you. Thanks to those who have supported so far!  Music Credit: Artist: DivKid | Track: Commander Impuls  #solarwinds #messenger #astrum","https://i.ytimg.com/vi/7BVDfYM67I4/maxresdefault.jpg"
"8lBHPBIOgMY","Asteroid Collision Shocked NASA Scientists, They Can't Explain Why This Happened | DART","1859144","33704","2022-11-24T17:49:08Z","dart, nasa, astrum, astrumspace, dart mission, nasa dart, nasa dart spaceship, nasa crash, mission dart, nasa crashing, dart impact nasa, nasa asteroid, dart asteroid, nasa dart mission, dart nasa, dart spacecraft, nasa asteroid crash, nasa asteroid mission, planetary defense, dimorphos, double asteroid redirection test, nasa crashing into asteroid, dart mission impact, asteroid dimorphos, didymos, planetary defense test, dimorphos asteroid, dimorphos nasa, dart crash","Real NASA images of the DART impact with Dimorphos. Enter at https://www.omaze.com/astrum  for your chance to win a Custom Tesla Model S-APEX and support a great cause, the Petersen Automotive Museum. The experience closes on January 27th at 11:59pm PST and I promise, you don’t want to miss this!  Astrum merch now available!  Apparel: https://astrum-shop.fourthwall.com/ Metal Posters: https://displate.com/promo/astrum?art=5f04759ac338b  SUBSCRIBE for more videos about our other planets. Subscribe! http://goo.gl/WX4iMN Facebook! http://goo.gl/uaOlWW Twitter! http://goo.gl/VCfejs Instagram! https://www.instagram.com/astrumspace/ TikTok! https://www.tiktok.com/@astrumspace  Astrum Spanish: https://bit.ly/2KmkssR Astrum Portuguese: https://www.youtube.com/channel/UChn_-OwvV63mr1yeUGvH-BQ  Donate!  Patreon: http://goo.gl/GGA5xT Ethereum Wallet: 0x5F8cf793962ae8Df4Cba017E7A6159a104744038  Become a Patron today and support my channel! Donate link above. I can't do it without you. Thanks to those who have supported so far!  #dart #nasa #dimorphos #astrum","https://i.ytimg.com/vi/8lBHPBIOgMY/maxresdefault.jpg"
"kSSKAuDvX70","Why You Aren't a True Umbraphile","102485","6131","2022-11-19T16:00:22Z","solar eclipse, total solar eclipse, eclipse, what is solar eclipse, what is the meaning of umbraphile, umbraphile definition, shadow lover, chasing solar eclipse, shorts, youtube shorts, space shorts, space, solar system, lunar eclipse, lunar eclipse 2022, total lunar eclipse, astronomy, lunar, lunar moon, airplane views, aviation, airplane window view, airplane window, astrum, astrumspace","#shorts Are you a shadow lover? Imagine being at the right place and time to catch a solar eclipse from an airplane window. Want to see what that is like? Watch until the very end.  Astrum merch now available! Apparel: https://teespring.com/stores/astrum-space  Metal Posters: https://displate.com/promo/astrum?art=5f04759ac338b  SUBSCRIBE for more videos about our other planets. Subscribe! http://goo.gl/WX4iMN Facebook! http://goo.gl/uaOlWW Twitter! http://goo.gl/VCfejs Instagram! https://www.instagram.com/astrumspace/ TikTok! https://www.tiktok.com/@astrumspace  Astrum Spanish: https://bit.ly/2KmkssR Astrum Portuguese: https://www.youtube.com/channel/UChn_-OwvV63mr1yeUGvH-BQ  Donate!  Patreon: http://goo.gl/GGA5xT Ethereum Wallet: 0x5F8cf793962ae8Df4Cba017E7A6159a104744038  Become a Patron today and support my channel! Donate link above. I can't do it without you. Thanks to those who have supported so far!  Music Credit: Artist: DivKid | Track: Commander Impuls  #solareclipse #umbraphile #astrum","https://i.ytimg.com/vi/kSSKAuDvX70/maxresdefault.jpg"
"tv3UrO2gHxQ","This Model Reveals the Universe Is Larger than Infinity. How Does that Work?","715479","21182","2022-11-17T17:44:52Z","edge of the universe, universe, journey to the edge of the universe, black hole, space, cosmos, hyperbolic, flat space, spherical space, flat spacetime, hyperbolic space, hyperbolic spacetime, nasa, astrum, astrumspace, the universe, spacetime, space documentary, inside a black hole, hyperbolic geometry, space discoveries, unveiled space, what if cosmos, black holes explained, space news, facts about space, space physics, physics, space facts, holographic universe, documentary","Is the universe flat, spherical or hyperbolic? Sponsored by Ridge Wallet. Use the link https://ridge.com/astrum/ to get the best offer of up to 40% off until Dec 22nd.  Series playlist: https://www.youtube.com/watch?v=tv3UrO2gHxQ&list=PL2gLpWRK0QlAxUUfLtFIGWauzb-c1vE4g  Astrum merch now available!  Apparel: https://astrum-shop.fourthwall.com/ Metal Posters: https://displate.com/promo/astrum?art=5f04759ac338b  SUBSCRIBE for more videos about our other planets. Subscribe! http://goo.gl/WX4iMN Facebook! http://goo.gl/uaOlWW Twitter! http://goo.gl/VCfejs Instagram! https://www.instagram.com/astrumspace/ TikTok! https://www.tiktok.com/@astrumspace  Astrum Spanish: https://bit.ly/2KmkssR Astrum Portuguese: https://www.youtube.com/channel/UChn_-OwvV63mr1yeUGvH-BQ  Donate!  Patreon: http://goo.gl/GGA5xT Ethereum Wallet: 0x5F8cf793962ae8Df4Cba017E7A6159a104744038  Become a Patron today and support my channel! Donate link above. I can't do it without you. Thanks to those who have supported so far!  #edgeoftheuniverse #astrum #shapeofspace","https://i.ytimg.com/vi/tv3UrO2gHxQ/maxresdefault.jpg"
"6LkYEfn3Cwo","The Discovery That Proved Scientists Wrong | ESA Rosetta Philae","2599818","47263","2022-11-14T21:55:03Z","rosetta, european space agency, comet, philae, esa, rosetta mission, 67p, comet 67p, philae lander, comet 67p/churyumov-gerasimenko, 67p/churyumov-gerasimenko, 67p/churyumov–gerasimenko, rosetta spacecraft, philae comet, comet mission, comet landing, rosetta philae, rosetta comet, comet esa, rosetta esa, what did philae discover, what did rosetta discover, rosetta timelapse, comets and asteroids, churyumov–gerasimenko, mission rosetta, astrum, astrumspace, rosetta probe, bbc news, mars","Almost everything you could want to know about ESA's Rosetta-Philae mission to comet 67P/Churyumov–Gerasimenko.   Astrum merch now available!  Apparel: https://astrum-shop.fourthwall.com/  Metal Posters: https://displate.com/promo/astrum?art=5f04759ac338b  SUBSCRIBE for more videos about our other planets. Subscribe! http://goo.gl/WX4iMN Facebook! http://goo.gl/uaOlWW Twitter! http://goo.gl/VCfejs Instagram! https://www.instagram.com/astrumspace/ TikTok! https://www.tiktok.com/@astrumspace  Astrum Spanish: https://bit.ly/2KmkssR Astrum Portuguese: https://www.youtube.com/channel/UChn_-OwvV63mr1yeUGvH-BQ  Donate!  Patreon: http://goo.gl/GGA5xT Ethereum Wallet: 0x5F8cf793962ae8Df4Cba017E7A6159a104744038  Become a Patron today and support my channel! Donate link above. I can't do it without you. Thanks to those who have supported so far!  #esa #rosetta #comet","https://i.ytimg.com/vi/6LkYEfn3Cwo/maxresdefault.jpg"
