"video_id","title","views","likes","publishedAt","tags","description","thumbnail_url"
"3ji4PcqIBEg","How a Planet with Seven Suns Proves the Universe Prefers Order","861662","29700","2020-07-03T16:04:59Z","star system, binary system, 7 star system, astrum, astrumspace","Can planets exist in multi-star systems, and what would that look like from their perspective? Thanks to Blinkist for sponsoring today's video. Get a 7-day free trial and 25% off their full membership here: https://www.blinkist.com/astrum  Astrum merch now available! https://teespring.com/stores/astrum-space  SUBSCRIBE for more videos about our other planets. Subscribe! http://goo.gl/WX4iMN Facebook! http://goo.gl/uaOlWW Twitter! http://goo.gl/VCfejs  Astrum Hindi: https://bit.ly/2OawGpx Astrum Spanish: https://bit.ly/2KmkssR Astrum Portuguese: https://www.youtube.com/channel/UChn_-OwvV63mr1yeUGvH-BQ  Donate!  Patreon: http://goo.gl/GGA5xT Ethereum Wallet: 0x5F8cf793962ae8Df4Cba017E7A6159a104744038  Become a Patron today and support my channel! Donate link above. I can't do it without you. Thanks to those who have supported so far!  Image Credits:  Space Engine/ESO  Music Credits:  Stellardrone - Eternity","https://i.ytimg.com/vi/3ji4PcqIBEg/maxresdefault.jpg"
"tyMbktsAScE","NASA Cassini's Final Images of Saturn Stunned Me","8997492","183844","2020-06-16T15:06:10Z","cassini, cassini nasa, nasa, saturn, cassini saturn, saturn nasa, astrum, astrumspace, nordvpn","In 2017, Cassini ended its mission by disintegrating in Saturn's atmosphere. What were the final images it ever took? GET NORDVPN: https://nordvpn.org/astrum USE COUPON CODE: astrum USE THE CODE SO YOU CAN GET 70% off 3-year plan + 1 additional month FREE. NordVPN YT: https://www.youtube.com/channel/UCSZhRxyloC-qzURiOa3vbFQ  Astrum merch now available! https://teespring.com/stores/astrum-space Bring outer space into your room with this Floating Moon Lamp: https://www.encalife.com/pages/_go_/floating-moon-lamp?ref=5403:574869  SUBSCRIBE for more videos about our other planets. Subscribe! http://goo.gl/WX4iMN Facebook! http://goo.gl/uaOlWW Twitter! http://goo.gl/VCfejs  Astrum Hindi: https://bit.ly/2OawGpx Astrum Spanish: https://bit.ly/2KmkssR Astrum Portuguese: https://www.youtube.com/channel/UChn_-OwvV63mr1yeUGvH-BQ  Donate!  Patreon: http://goo.gl/GGA5xT Ethereum Wallet: 0x5F8cf793962ae8Df4Cba017E7A6159a104744038  Become a Patron today and support my channel! Donate link above. I can't do it without you. Thanks to those who have supported so far!  Image Credits:  NASA  Music Credits:  Anima - The Waning Moon Andrew Odd - Leaving","https://i.ytimg.com/vi/tyMbktsAScE/maxresdefault.jpg"
"MmGlg-tVk0E","The Insane Power of Storms Observed in the Solar System /w Primal Space","886031","18984","2020-06-07T17:30:00Z","great red spot, solar storms, great dark spot, polar vortices, polar vortex, titan, venus, uranus, neptune, jupiter, saturn, earth, solar system, nasa, esa, hubble, voyager","Storms are a regular occurrence throughout the solar system, and they can get BIG. So what are the largest ones we've ever observed? Thanks to @primalspace for collaborating and providing the narration for this video!  SUBSCRIBE for more videos about our other planets. Subscribe! http://goo.gl/WX4iMN Facebook! http://goo.gl/uaOlWW Twitter! http://goo.gl/VCfejs  Astrum Hindi: https://bit.ly/2OawGpx Astrum Spanish: https://bit.ly/2KmkssR Astrum Portuguese: https://www.youtube.com/channel/UChn_-OwvV63mr1yeUGvH-BQ  Donate!  Patreon: http://goo.gl/GGA5xT Ethereum Wallet: 0x5F8cf793962ae8Df4Cba017E7A6159a104744038  Become a Patron today and support my channel! Donate link above. I can't do it without you. Thanks to those who have supported so far!  Image Credits:  NASA/ESA/Sean Doran  Music Credits:  Adrian Chifu - Eternal Traveller Marek Poledna","https://i.ytimg.com/vi/MmGlg-tVk0E/maxresdefault.jpg"
"GnWJIWezuuc","This Is What Happens When Countries/Companies Compete To Get Humans Into Space","81923","5050","2020-06-01T15:01:06Z","space x, spacex, nasa, boeing, dragon, falcon","Yesterday, on the 31st May 2020, NASA and SpaceX successfully docked their Dragon capsule with the ISS. But what makes this event so significant? And is using private space companies really cheaper? SUBSCRIBE for more videos about our other planets. Subscribe! http://goo.gl/WX4iMN Facebook! http://goo.gl/uaOlWW Twitter! http://goo.gl/VCfejs  Astrum Hindi: https://bit.ly/2OawGpx Astrum Spanish: https://bit.ly/2KmkssR Astrum Portuguese: https://www.youtube.com/channel/UChn_-OwvV63mr1yeUGvH-BQ  Donate!  Patreon: http://goo.gl/GGA5xT Ethereum Wallet: 0x5F8cf793962ae8Df4Cba017E7A6159a104744038  Become a Patron today and support my channel! Donate link above. I can't do it without you. Thanks to those who have supported so far!  Image Credits:  NASA/SpaceX/Boeing/ROSCOSMOS  Music Credits:  Adrian Chifu - Eternal Traveller","https://i.ytimg.com/vi/GnWJIWezuuc/maxresdefault.jpg"
"kDHouMEXHQg","The Largest Planetary System that Could Exist","831522","29533","2020-05-20T17:54:59Z","None","How big do you think our solar system is? Up until Pluto? A bit beyond? How big can other solar systems get? Astrum answers!  SUBSCRIBE for more videos about our other planets. Subscribe! http://goo.gl/WX4iMN Facebook! http://goo.gl/uaOlWW Twitter! http://goo.gl/VCfejs  Astrum Hindi: https://bit.ly/2OawGpx Astrum Spanish: https://bit.ly/2KmkssR  Donate!  Patreon: http://goo.gl/GGA5xT Ethereum Wallet: 0x5F8cf793962ae8Df4Cba017E7A6159a104744038  Become a Patron today and support my channel! Donate link above. I can't do it without you. Thanks to those who have supported so far!  Image Credits:  NASA/ESO/Space Engine  Music Credits:  Stellardrone - Eternity Mark LaFountain - Obscured","https://i.ytimg.com/vi/kDHouMEXHQg/maxresdefault.jpg"
"4zdwo7ZvhMk","Hubble's Unexpected Discoveries in the Solar System | Hubble Images Episode 10","1066357","18039","2020-05-08T17:08:17Z","None","Hubble doesn't just look at distant nebula and galaxies, but has also observed celestial bodies and events in our own solar system. So what has it seen? Images from Hubble / NASA / ESA.  More Hubble Images in this playlist: https://www.youtube.com/playlist?list=PL2gLpWRK0QlCPaLzEw8I3yL72CM2EzC-k  SUBSCRIBE for more videos about our other planets. Subscribe! http://goo.gl/WX4iMN Facebook! http://goo.gl/uaOlWW Twitter! http://goo.gl/VCfejs  Astrum Hindi: https://bit.ly/2OawGpx Astrum Spanish: https://bit.ly/2KmkssR  Donate!  Patreon: http://goo.gl/GGA5xT Ethereum Wallet: 0x5F8cf793962ae8Df4Cba017E7A6159a104744038  Become a Patron today and support my channel! Donate link above. I can't do it without you. Thanks to those who have supported so far!  Image Credits:  NASA/ESA/Hubble  Music Credits:  Stellardrone - Billions and Billions Meydän - Pure Water","https://i.ytimg.com/vi/4zdwo7ZvhMk/maxresdefault.jpg"
"U07TiwmjekM","The Universe's Largest Planets","745547","23841","2020-04-24T16:22:58Z","biggest planet, largest planet, astrum, astrumspace, nasa, esa, eso","What makes a planet a planet? And what makes a star a star? Once we know this these defining characteristics, we start to notice that these definitions can overlap. Which begs the question, can a planet be bigger than its parent star?  SUBSCRIBE for more space videos: http://goo.gl/WX4iMN Patreon: http://goo.gl/GGA5xT Facebook! http://goo.gl/uaOlWW Twitter! http://goo.gl/VCfejs Ethereum Wallet: 0x5F8cf793962ae8Df4Cba017E7A6159a104744038  Become a Patron today and support Astrum! Donate link above. I can't do it without you. Patreons can help pick the next Astrum Answers in a regular poll. Thanks to those who have supported so far!  Astrum Spanish: https://bit.ly/2KmkssR  Image Credits: NASA/ESO/ESA/Hubble/Space Engine/Universe Sandbox Music Credits: Marek Poledna","https://i.ytimg.com/vi/U07TiwmjekM/maxresdefault.jpg"
"DOyCuhb7xa0","Why Scientists Want Blurry Photos With This Telescope | ESA CHEOPS","192074","7848","2020-04-15T15:42:50Z","cheops, exoplanets, exoplanet, esa","It seems counterintuitive, but ESA's newest space telescope, CHEOPS, is designed to take blurry images of stars. But this helps astronomers to understand more about orbiting exoplanets than a clear image would. Here's why! Thanks to Rafa for helping make this video. Astrum Spanish channel: https://bit.ly/2KmkssR  SUBSCRIBE for more space videos: http://goo.gl/WX4iMN Patreon: http://goo.gl/GGA5xT Facebook! http://goo.gl/uaOlWW Twitter! http://goo.gl/VCfejs Ethereum Wallet: 0x5F8cf793962ae8Df4Cba017E7A6159a104744038  Become a Patron today and support Astrum! Donate link above. I can't do it without you. Patreons can help pick the next Astrum Answers in a regular poll. Thanks to those who have supported so far!  Image Credits: NASA/ESO/ESA/Hubble Music Credits: Marek Poledna","https://i.ytimg.com/vi/DOyCuhb7xa0/maxresdefault.jpg"
"-d1ZBrSBYmg","This Is Why Space Shouldn't Be Black | Olbers' Paradox","300017","13574","2020-04-07T18:15:36Z","olber's paradox, olbers paradox, astrum, astrumspace, astrum answers","Olbers' Paradox. With so many stars in the universe, why is space black and not white with light? Astrum Answers! SUBSCRIBE for more space videos: http://goo.gl/WX4iMN Patreon: http://goo.gl/GGA5xT  Facebook! http://goo.gl/uaOlWW Twitter! http://goo.gl/VCfejs Ethereum Wallet: 0x5F8cf793962ae8Df4Cba017E7A6159a104744038  Become a Patron today and support Astrum! Donate link above. I can't do it without you. Patreons can help pick the next Astrum Answers in a fortnightly poll. Thanks to those who have supported so far!  Astrum Spanish: https://bit.ly/2KmkssR  Image Credits: NASA/ESO/ESA/Hubble/Pixabay Music Credits: Stellardrone - Billions and Billions Meydaen - Pure Water","https://i.ytimg.com/vi/-d1ZBrSBYmg/maxresdefault.jpg"
"Bat2WS9qBNw","The Real Worry About Panspermia","393740","12375","2020-03-31T16:28:56Z","virus, coronavirus, astrum, astrumspace, nasa, esa, sterilization, clean room, can microbes travel through space, space travel, microbes, germs, bacteria, viruses, microbes in space, space","Forward and backward Panspermia. Can alien bacteria and viruses thrive and infect us on Earth? Here are my findings! SUBSCRIBE for more space videos: http://goo.gl/WX4iMN Patreon: http://goo.gl/GGA5xT  Facebook! http://goo.gl/uaOlWW Twitter! http://goo.gl/VCfejs Ethereum Wallet: 0x5F8cf793962ae8Df4Cba017E7A6159a104744038  Become a Patron today and support Astrum! Donate link above. I can't do it without you. Patreons can help pick the next Astrum Answers in a fortnightly poll. Thanks to those who have supported so far!  Astrum Spanish: https://bit.ly/2KmkssR  Image Credits: NASA/ESO/ESA/Pixabay Music Credits: YouTube Library - Mist Stellardrone - Ultra Deep Field Lee Rosevere and Daniel Birch - Sagittarius A","https://i.ytimg.com/vi/Bat2WS9qBNw/maxresdefault.jpg"
"ceFl7NlpykQ","Why All The Planets Are On The Same Orbital Plane","1893253","47326","2020-03-20T17:18:53Z","orbital plain, astrum, astrumanswers, nasa","Is it a coincidence? Or is something else at play here? SUBSCRIBE for more space videos: http://goo.gl/WX4iMN Patreon: http://goo.gl/GGA5xT  Facebook! http://goo.gl/uaOlWW Twitter! http://goo.gl/VCfejs Ethereum Wallet: 0x5F8cf793962ae8Df4Cba017E7A6159a104744038  Become a Patron today and support Astrum! Donate link above. I can't do it without you. Patreons can help pick the next Astrum Answers in a fortnightly poll. Thanks to those who have supported so far!  Astrum Spanish: https://bit.ly/2KmkssR  Image Credits: NASA/ESO/ESA/Sean Doran/Matthew Bate/Space Engine/NOAA/apbiolghs/UK Astrophysical Fluids Facility Music Credits: Ketsa - Angel Falling, YouTube Library - Mist","https://i.ytimg.com/vi/ceFl7NlpykQ/maxresdefault.jpg"
"gOWHigxX3S8","The Iron Rain World Is Unlike Anything You've Seen Before","177745","7555","2020-03-12T17:25:26Z","wasp 76b, eso, very large telescope, astrum, astrumspace, wasp 67 b","There is an exoplanet, discovered by ESO's VLT, where it rains iron. But WASP-67b is 690 light years away, how could we possibly know that? SUBSCRIBE for more videos about our other planets. Subscribe! http://goo.gl/WX4iMN Facebook! http://goo.gl/uaOlWW Twitter! http://goo.gl/VCfejs Donate!  Patreon: http://goo.gl/GGA5xT Ethereum Wallet: 0x5F8cf793962ae8Df4Cba017E7A6159a104744038  Become a Patron today and support Astrum! Donate link above. I can't do it without you. Patreons can help pick the next Astrum Answers in a fortnightly poll. Thanks to those who have supported so far!  Astrum Spanish: https://bit.ly/2KmkssR  Image Credits: NASA/Gemini/Sean Doran Music Credits: Stellardrone - Billions and Billions","https://i.ytimg.com/vi/gOWHigxX3S8/maxresdefault.jpg"
"_Qa1bPh0lGA","Earth's New ""Moon"" 101","231355","8638","2020-03-02T18:31:18Z","second moon, nasa moon, nasa","While tiny, Earth now has a second moon, or natural satellite, named 2020 CD3. So, will we have to rewrite the text books? SUBSCRIBE for more videos about our other planets. Subscribe! http://goo.gl/WX4iMN Facebook! http://goo.gl/uaOlWW Twitter! http://goo.gl/VCfejs Donate!  Patreon: http://goo.gl/GGA5xT Ethereum Wallet: 0x5F8cf793962ae8Df4Cba017E7A6159a104744038  Become a Patron today and support Astrum! Donate link above. I can't do it without you. Patreons can help pick the next Astrum Answers in a fortnightly poll. Thanks to those who have supported so far!  Astrum Spanish: https://bit.ly/2KmkssR  Image Credits: NASA/Gemini/Sean Doran Music Credits: Stellardrone - Billions and Billions","https://i.ytimg.com/vi/_Qa1bPh0lGA/maxresdefault.jpg"
"wtg7DiSo2Fs","The Strangest Object Discovered on Mars | Opportunity Episode 6","1001682","24954","2020-02-21T16:44:36Z","opportunity rover, nasa, nasa opportunity, what did opportunity find on mars, astrum, astrumspace","NASA's Opportunity had just made the most important discovery of its mission, the rock vein known as Esperance. But what happened next? Cheap currency conversions with Transferwise: https://prf.hn/l/78gReNK  Opportunity Playlist: https://www.youtube.com/playlist?list=PL2gLpWRK0QlD20yE8cIafJ8da0gUyWmbw  SUBSCRIBE for more videos about our other planets. Subscribe! http://goo.gl/WX4iMN Facebook! http://goo.gl/uaOlWW Twitter! http://goo.gl/VCfejs Donate!  Patreon: http://goo.gl/GGA5xT Ethereum Wallet: 0x5F8cf793962ae8Df4Cba017E7A6159a104744038  Become a Patron today and support Astrum! Donate link above. I can't do it without you. Patreons can help pick the next Astrum Answers in a fortnightly poll. Thanks to those who have supported so far!  Astrum Spanish: https://bit.ly/2KmkssR  Image Credits: NASA/Hubble Music Credits: Stellardrone - Eternity","https://i.ytimg.com/vi/wtg7DiSo2Fs/maxresdefault.jpg"
"CYVkfnx6LcY","Why NASA Wants To Build A Space Station Around The Moon | NASA Gateway, SLS and Artemis","222850","7265","2020-02-08T20:41:37Z","astrum, astrumspace, nasa, esa, nasa artemis, nasa gateway, gateway, artemis, sls, space launch system","Gateway is NASA's most ambitious project yet, so how to they plan to get a space station around the Moon? And why have one there in the first place? SLS, Artemis and Gateway. This video was a collaboration with Astrum Spanish and El Robot de Platon. Links to their channels here: Astrum Spanish - https://www.youtube.com/channel/UC-2A6Z4k5-AJBLO_wDA-ZUg El Robot de Platon - https://www.youtube.com/user/ElRobotdePlaton   SUBSCRIBE for more videos about our other planets. Subscribe! http://goo.gl/WX4iMN Facebook! http://goo.gl/uaOlWWTwitter! http://goo.gl/VCfejsDonate!  Patreon: http://goo.gl/GGA5xT Ethereum Wallet: 0x5F8cf793962ae8Df4Cba017E7A6159a104744038  Become a Patron today and support Astrum! Donate link above. I can't do it without you. Patreons can help pick the next Astrum Answers in a fortnightly poll. Thanks to those who have supported so far!  Image Credits: NASA/ESA Music Credits: Stellardrone - Billions and Billions Stellardrone - Crepuscular Rays","https://i.ytimg.com/vi/CYVkfnx6LcY/maxresdefault.jpg"
"JnbQ02S2gVk","You Won't Believe What Can Be Found on the Moon | 4K LRO Episode 3","1230251","20141","2020-02-04T15:40:21Z","LRO, LROC, lunar reconnaissance orbiter, nasa, astrum, astrumspace","NASA's Lunar Reconnaissance Orbiter shows the Moon has some pretty unusual features! WORLD OF WARSHIPS link: http://go.thoughtleaders.io/1675320200201 Register to receive a bunch of bonuses when you use code BATTLESTATIONS2020. Applicable to new users only.  Want the episode playlist? https://www.youtube.com/playlist?list=PL2gLpWRK0QlBOzmGtXt1y_gnS2WShTbTa  Want to explore the 3D model of the Moon with Quickmap? https://quickmap.lroc.asu.edu/  Want to explore some of the LRO images yourself? http://lroc.sese.asu.edu/images  SUBSCRIBE for more videos about our other planets. Subscribe! http://goo.gl/WX4iMN Facebook! http://goo.gl/uaOlWWTwitter! http://goo.gl/VCfejsDonate!  Patreon: http://goo.gl/GGA5xT Ethereum Wallet: 0x5F8cf793962ae8Df4Cba017E7A6159a104744038  Become a Patron today and support Astrum! Donate link above. I can't do it without you. Patreons can help pick the next Astrum Answers in a fortnightly poll. Thanks to those who have supported so far!  Astrum Hindi: https://bit.ly/2OawGpx Astrum Spanish: https://bit.ly/2KmkssR  Image Credits: NASA/LRO Music Credits: Stellardrone - Eternity","https://i.ytimg.com/vi/JnbQ02S2gVk/maxresdefault.jpg"
"_GeapdGbGEc","How Bad Really Is the Radiation on Mars?","950663","25455","2020-01-27T18:24:02Z","mars radiation, space radiation, nasa, astrum, astrumspace","How do scientists plan to get astronauts to Mars when space radiation is so strong? What can be done about it? Astrum Answers! SUBSCRIBE for more videos about our other planets. Subscribe! http://goo.gl/WX4iMN Facebook! http://goo.gl/uaOlWW Twitter! http://goo.gl/VCfejs  Donate!  Patreon: http://goo.gl/GGA5xT Ethereum Wallet: 0x5F8cf793962ae8Df4Cba017E7A6159a104744038  Become a Patron today and support Astrum! Donate link above. I can't do it without you. Patreons can help pick the next Astrum Answers in a fortnightly poll. Thanks to those who have supported so far!  Astrum Hindi: https://bit.ly/2OawGpx Astrum Spanish: https://bit.ly/2KmkssR  Image Credits: NASA/HASSELL  Music Credits: Stellardrone - Billions and Billions","https://i.ytimg.com/vi/_GeapdGbGEc/maxresdefault.jpg"
"b3woNwAit1E","How the Australian Wildfires Developed | 4K Time-lapse from Space","166114","5502","2020-01-17T18:39:31Z","australia bushfire, australia wildfire, bushfires, wildfires, view from space, astrum, astrumspace","View from space of the Australian bushfires, from the December 30th 2019 to January 2nd 2020. Based on data from JAXA / JMA / Himawari. Time lapse produced by Seán Doran, check out his amazing channel here: https://www.youtube.com/channel/UC28l88GMXXqZYfY0Ru9h50w  SUBSCRIBE for more videos about our other planets. Subscribe! http://goo.gl/WX4iMN Facebook! http://goo.gl/uaOlWW Twitter! http://goo.gl/VCfejs  Donate!  Patreon: http://goo.gl/GGA5xT Ethereum Wallet: 0x5F8cf793962ae8Df4Cba017E7A6159a104744038  Become a Patron today and support Astrum! Donate link above. I can't do it without you. Patreons can help pick the next Astrum Answers in a fortnightly poll. Thanks to those who have supported so far!  Astrum Hindi: https://bit.ly/2OawGpx Astrum Spanish: https://bit.ly/2KmkssR  Image Credits: JAXA, BBC","https://i.ytimg.com/vi/b3woNwAit1E/maxresdefault.jpg"
"MN1xmITLv0Y","The Most Important Space Missions Launching In 2020","166928","6073","2020-01-14T13:41:28Z","2020, espacio 2020, misiones espaciales 2020, space 2020, space missions 2020, nasa, esa, roscosmos, cnsa, jaxa, csa, isro, mohammed bin rashid space center, mbrsc, dron marte, drone mars, mars 2020, rover, marte 2020, chang'e 5, huoxin-1, chandrayaan-3, chang'e, huoxin, chandrayaan, hope mars mission, cheops, telescopio cheops, cheops telescope, al-amal mars mission, rosalind franklin rover, artemis nasa, artemis luna, artemis moon, gateway, moon, luna, mars mission, mision marte, exomars","What's happening in 2020 with space agencies across the world? Thanks to 'Astrum ES' for collaborating with me to make this video possible. Check out their channels here: https://www.youtube.com/channel/UC-2A6Z4k5-AJBLO_wDA-ZUg   SUBSCRIBE for more videos about our other planets. Subscribe! http://goo.gl/WX4iMN Facebook! http://goo.gl/uaOlWW Twitter! http://goo.gl/VCfejs  Donate!  Patreon: http://goo.gl/GGA5xT Ethereum Wallet: 0x5F8cf793962ae8Df4Cba017E7A6159a104744038  Become a Patron today and support Astrum! Donate link above. I can't do it without you. Patreons can help pick the next Astrum Answers in a fortnightly poll. Thanks to those who have supported so far!  Astrum Hindi: https://bit.ly/2OawGpx Astrum Spanish: https://bit.ly/2KmkssR  Image Credits: NASA ISRO ESA CNSA","https://i.ytimg.com/vi/MN1xmITLv0Y/maxresdefault.jpg"
"Y6iIutoaM-g","NASA's Genius Technique That Measures Stars","111139","4390","2019-12-20T18:15:52Z","astrum, astrumspace, nasa, parallax method, color magnitude, type ia supernova","Scientists can't use tape measures, rulers or lasers to measure the astronomical distances to stars and galaxies, so how do we do it? Go to https://squarespace.com/astrum to get a free trial and 10% off your first purchase.  SUBSCRIBE for more videos about our other planets. Subscribe! http://goo.gl/WX4iMN Facebook! http://goo.gl/uaOlWW Twitter! http://goo.gl/VCfejs  Donate!  Patreon: http://goo.gl/GGA5xT Ethereum Wallet: 0x5F8cf793962ae8Df4Cba017E7A6159a104744038  Become a Patron today and support Astrum! Donate link above. I can't do it without you. Patreons can help pick the next Astrum Answers in a fortnightly poll. Thanks to those who have supported so far!  Astrum Hindi: https://bit.ly/2OawGpx Astrum Spanish: https://bit.ly/2KmkssR  Music Credit: Stellardrone - Cepheid  Image Credits: NASA ESO ESA Space Engine","https://i.ytimg.com/vi/Y6iIutoaM-g/maxresdefault.jpg"
"13eztn3RxQw","The Discoveries On Ceres That Shocked NASA Scientists | Dawn Mission","821422","19811","2019-12-14T21:14:08Z","ceres, dawn, nasa, nasa dawn, nasa ceres, astrum, astrumspace, what did dawn discover","NASA's Dawn mission finished in 2017. What did it discover while in orbit around Ceres? Get Surfshark VPN at https://surfshark.deals/astrum - Enter promo code ASTRUM for 83% off and 3 extra months for free!  SUBSCRIBE for more videos about our other planets. Subscribe! http://goo.gl/WX4iMN Facebook! http://goo.gl/uaOlWW Twitter! http://goo.gl/VCfejs  Donate!  Patreon: http://goo.gl/GGA5xT Ethereum Wallet: 0x5F8cf793962ae8Df4Cba017E7A6159a104744038  Become a Patron today and support Astrum! Donate link above. I can't do it without you. Patreons can help pick the next Astrum Answers in a fortnightly poll. Thanks to those who have supported so far!  Astrum Hindi: https://bit.ly/2OawGpx Astrum Spanish: https://bit.ly/2KmkssR  Music Credit:   Andrew Odd - Leaving   Ketsa - Angel Falling  Image Credits: NASA","https://i.ytimg.com/vi/13eztn3RxQw/maxresdefault.jpg"
"evTpXGTXab4","This Is NOT What A Nebula Looks Like","153660","5721","2019-12-10T15:53:42Z","nebula colours, hubble space telescope, hubble, nasa, eso, hubble nasa, eso nebula, what makes nebula so colourful, why are nebula so colourful, why are nebula so colorful","Thanks to the Hubble Space Telescope, we have seen nebula like never before. But are they really as colourful as Hubble makes out? Go to https://squarespace.com/astrum to get a free trial and 10% off your first purchase.  SUBSCRIBE for more videos about our other planets. Subscribe! http://goo.gl/WX4iMN Facebook! http://goo.gl/uaOlWW Twitter! http://goo.gl/VCfejs  Donate!  Patreon: http://goo.gl/GGA5xT Ethereum Wallet: 0x5F8cf793962ae8Df4Cba017E7A6159a104744038  Become a Patron today and support Astrum! Donate link above. I can't do it without you. Patreons can help pick the next Astrum Answers in a fortnightly poll. Thanks to those who have supported so far!  Astrum Hindi: https://bit.ly/2OawGpx Astrum Spanish: https://bit.ly/2KmkssR  Music Credit: Stellardrone - Cepheid Anima - You are Truth  Image Credits: NASA ESO","https://i.ytimg.com/vi/evTpXGTXab4/maxresdefault.jpg"
"vzpN5VDMzns","How Asteroid Bennu Stumped NASA Mission Planners | OSIRIS-Rex","525955","11742","2019-12-04T23:09:52Z","osiris-rex, osiris rex, osiris rex nasa, nasa, bennu, bennu nasa, bennu osiris rex, osiris rex bennu, what has osiris rex discovered so far, astrum, astrumspace","NASA's OSIRIS-REx has now been orbiting the asteroid Bennu for a year already, but what has it discovered so far? https://brilliant.org/astrum/  ************** A big thank you to Brilliant for supporting this video. Sign up for free using the link above. That link will also get the first 200 subscribers 20% off a premium subscription to the website if you like what you see. **************  SUBSCRIBE for more videos about our other planets. Subscribe! http://goo.gl/WX4iMN Facebook! http://goo.gl/uaOlWW Twitter! http://goo.gl/VCfejs  Astrum Hindi: https://bit.ly/2OawGpx Astrum Spanish: https://bit.ly/2KmkssR  Donate!  Patreon: http://goo.gl/GGA5xT Ethereum Wallet: 0x5F8cf793962ae8Df4Cba017E7A6159a104744038  Become a Patron today and support my channel! Donate link above. I can't do it without you. Thanks to those who have supported so far!  Image Credits:  NASA  Music Credits:  Stellardrone - Billions and Billions","https://i.ytimg.com/vi/vzpN5VDMzns/maxresdefault.jpg"
