"video_id","title","views","likes","publishedAt","tags","description","thumbnail_url"
"EMRdV-3L1n0","These Images Will Change Your View of Comets Forever (And They Blew Our Minds!)","1814035","23447","2024-09-23T17:00:13Z","astrum, astronomy, space, universe, comets, physics, asteroids, nasa, ESO, ESA, celestial, UFO, Halley's comet, Halley, jupiter, Oort cloud, Neptune, short period comet, Sun, stars, Kuiper belt, great comets, solar system, Giacobini-Zinner, International Cometary Explorer, Halley Armada, JAXA, Vega, Venus, ISAS, Suisei, sakigake, Giotto, interplanetary space, Palomar Observatory, Great Red Spot, Shoemaker-Levy, Hubble, Galileo, Keck Observatory, Near Earth Objects, Deep impact, Temple 1, EPOXI, Rosetta-Philae","Join us for a supercut episode on everything Astrum knows about comets! A huge thanks to our Patreons who help make these videos possible. Sign-up here: https://bit.ly/4aiJZNF  Astrum Podcast: https://www.buzzsprout.com/2250635/share Displate Posters: https://astrumspace.info/Displates Astrum Merch! https://astrum-shop.fourthwall.com/ Join us on the Astrum discord: https://discord.gg/TKw8Hpvtv8  SUBSCRIBE for more videos about space and astronomy.  Subscribe! http://goo.gl/WX4iMN Facebook! http://goo.gl/uaOlWW Twitter! http://goo.gl/VCfejs  Astrum Spanish: https://www.youtube.com/@astrumespanol Astrum Portuguese: https://www.youtube.com/channel/UChn_-OwvV63mr1yeUGvH-BQ  Credits Writer: Jon McColgan Editor: Nathalia Gardin Thumbnail Designer: Peter Sheppard Producer: Alex McColgan / Raquel Taylor   NASA/ESO/ESA   #Astrum #astronomy #comets #astrophysics #physics #NASA #solar system","https://i.ytimg.com/vi/EMRdV-3L1n0/maxresdefault.jpg"
"sabLh0F0rzA","What La Niña Will do to Earth in 2025","4418639","77536","2024-09-17T17:00:47Z","Astrum, astronomy, physics, earth science, space physics, space, Earth, earth cycles, climate change, climate, science, weather, natural disasters, extreme weather, ENSO, El Niño Southern Oscillation, El nino, la nina, weather patterns, ENSO neutral, International Space Station, tropical rainforests, equator, Hadley Cell rotation, Coriolis Effect, trade winds, Walker Circulation, Southern Oscillation, Pacific Ocean, phytoplankton, Atlantic Ocean, sea surface temperature, flooding","After the extreme weather events and early end to El Nino, what can we expect from La Nina?🔒Remove your personal information from the web at https://joindeleteme.com/ASTRUM and use code ASTRUM for 20% off 🙌 DeleteMe international Plans: https://international.joindeleteme.com  Astrum Podcast: https://www.buzzsprout.com/2250635/share Displate Posters: https://displate.com/promo/astrum?art=5f04759ac338b  Astrum Merch! https://astrum-shop.fourthwall.com/ Join us on the Astrum discord: https://discord.gg/TKw8Hpvtv8  SUBSCRIBE for more videos about space and astronomy.  Subscribe! http://goo.gl/WX4iMN Facebook! http://goo.gl/uaOlWW Twitter! http://goo.gl/VCfejs  Astrum Spanish: https://www.youtube.com/@astrumespanol Astrum Portuguese: https://www.youtube.com/channel/UChn_-OwvV63mr1yeUGvH-BQ  Visit our Patreon to donate. Patreon: https://bit.ly/4aiJZNF  Credits Writer:  Michelle Babcock Editor: Nick Shishkin Thumbnail Designer: Peter Sheppard Producer: Alex McColgan/ Raquel Taylor   #astrum #astronomy #science #climatechange #earthscience #lanina","https://i.ytimg.com/vi/sabLh0F0rzA/maxresdefault.jpg"
"HRI43mqhKEQ","Alien Is Not as Far-fetched as You Might Think","1217506","32533","2024-09-12T16:12:50Z","astrum, astronomy, physics, biology, science, Alien, Romulus, universe, space, space ships, aliens, spaceships, movies, films, facehugger, xenomorph, astroarchaeology, ellen ripley, sigourney weaver, nostromo, prometheus, younger dryas, space travel, seta reticuli, reticulum, calpamos, CRISPR, morphing, black goo, Interstellar, avatar, NASA, hypersleep, parasitic wasps, Tarantula Hawk Wasp, exoskeleton, exoplanet, fungus, Sacculina, fluoroantimonic acid, silicon based, acidic blood","Astrum Investigates the Science of the Alien franchise, separating the fact from the fiction. And a huge thanks to our Patreons who help make these videos possible. It’s not too late to become one of the first 1000 Astrumnauts - Sign-up here: https://bit.ly/4aiJZNF  Astrum Podcast: https://www.buzzsprout.com/2250635/share Displate Posters: https://displate.com/promo/astrum?art=5f04759ac338b  Astrum Merch! https://astrum-shop.fourthwall.com/ Join us on the Astrum discord: https://discord.gg/TKw8Hpvtv8  SUBSCRIBE for more videos about space and astronomy.  Subscribe! http://goo.gl/WX4iMN Facebook! http://goo.gl/uaOlWW Twitter! http://goo.gl/VCfejs  Astrum Spanish: https://www.youtube.com/@astrumespanol Astrum Portuguese: https://www.youtube.com/channel/UChn_-OwvV63mr1yeUGvH-BQ  Visit our Patreon to donate. Patreon: https://bit.ly/4aiJZNF  Credits Writer:  Callum Griffiths Editor: Frame Forge Thumbnail Designer: Peter Sheppard Producer: Alex McColgan/ Raquel Taylor   Clarification: pH can only be measured in water-based solutions and superacids are explosive/not soluble in water, so it doesn’t make sense to place them on a PH scale and instead we should use the Hammett Acidity Function (H0). That being said, we can and do typically derive negative pH from this function using the Henderson-Hasselbalch equation which makes H0 equivalent to the pH values. This should have been explained further in the video.  Correction: Zeti Reticuli only being visible from the Southern Hemisphere is part of the plot, suggesting those on the Northern Hemisphere must have received this information from aliens or advanced means. Thank you, to everyone in the comments who pointed this out.  #astrum #astronomy #science #alien #film","https://i.ytimg.com/vi/HRI43mqhKEQ/maxresdefault.jpg"
"59cw_bDbEqA","Malicious Attack on $5 Million Telescope. Scientists Don’t Care.","450750","16702","2024-09-05T17:00:03Z","astrum, astronomy, space, universe, Earth, Observatory, science, telescopes, Harlan J Smith Telescope, largest telescope, NASA, McDonald Observatory, University of Texas, Harlan J Smith, Fort David, exoplanet, spectroscopy, Jack Hyde, observatory shooting, voyager, critical area, diffraction, telescope mirror, resolution, fused silica, bulletproof, hammer, glass mirror, astronomy technology, Smithsonian Observatory","Shot 7 times, yet the Harlan J Smith telescope at the McDonald Observatory still had 99% functionality. How?! Pre-order a copy of the Astrum Book Incredible Universe: The Solar System https://astrumspace.info/3MeH3aj And a huge thanks to our Patreons who help make these videos possible. It’s not too late to become one of the first 1000 Astrumnauts - Sign-up here: https://bit.ly/4aiJZNF  Astrum Podcast: https://www.buzzsprout.com/2250635/share Displate Posters: https://displate.com/promo/astrum?art=5f04759ac338b  Astrum Merch! https://astrum-shop.fourthwall.com/ Join us on the Astrum discord: https://discord.gg/TKw8Hpvtv8  SUBSCRIBE for more videos about space and astronomy.  Subscribe! http://goo.gl/WX4iMN Facebook! http://goo.gl/uaOlWW Twitter! http://goo.gl/VCfejs  Astrum Spanish: https://www.youtube.com/@astrumespanol Astrum Portuguese: https://www.youtube.com/channel/UChn_-OwvV63mr1yeUGvH-BQ  Visit our Patreon to donate. Patreon: https://bit.ly/4aiJZNF  Credits Writer:  Jon McColgan Editor: Nathalia Gardin Thumbnail Designer: Peter Sheppard Producer: Alex McColgan/ Raquel Taylor   NASA/ESO/ESA  Thanks to:  McDonald Observatory  #Astrum #Astronomy #Space #telescopes  #observatory #scienceandtechnology","https://i.ytimg.com/vi/59cw_bDbEqA/maxresdefault.jpg"
"yV0ArmJDtd8","NASA Tried to Screw Astronauts Over Money - and Paid the Price Big Time","424129","10156","2024-08-30T17:45:53Z","Astrum, NASA, Moon, Lunar Mission, Moon mission, NASA mission, Apollo, Apollo mission, Apollo 15, astronauts, space, space mission, space agency, genesis rock, Apollo postal scandal, astronomy, Kennedy space centre, Herman Sieger, Horst Eiermann, postal covers, David scott, Alfred worden, james Irwin, Sieger, stamp collectors, buzz aldrin, Apollo 14, cold war, Deke slayton, james smotherman, lunar rover, spacewalk, US postal service, apollo 17, justice department","We investigate the scandal that was the Apollo 15 Lunar mission. Compare news coverage. Spot media bias. Avoid algorithms. Try Ground News today and get 40% off your subscription by going to https://ground.news/astrum  Astrum Podcast: https://www.buzzsprout.com/2250635/share Displate Posters: https://astrumspace.info/Displates Astrum Merch! https://astrum-shop.fourthwall.com/ Join us on the Astrum discord: https://discord.gg/TKw8Hpvtv8  Pre-order a copy of the Astrum Book Incredible Universe: The Solar System https://astrumspace.info/3MeH3aj  A huge thanks to our Patreons who help make these videos possible. Sign-up here: https://bit.ly/4aiJZNF  SUBSCRIBE for more videos about space and astronomy.  Subscribe! http://goo.gl/WX4iMN Facebook! http://goo.gl/uaOlWW Twitter! http://goo.gl/VCfejs  Astrum Spanish: https://www.youtube.com/@astrumespanol Astrum Portuguese: https://www.youtube.com/channel/UChn_-OwvV63mr1yeUGvH-BQ  Credits Writer: Julia Masselos Editor: Nick Shishkin Thumbnail Designer: Peter Sheppard Producer: Alex McColgan / Raquel Taylor   NASA/ESO/ESA   #astrum #nasa #moon #lunar #spaceexploration #space #astronauts","https://i.ytimg.com/vi/yV0ArmJDtd8/maxresdefault.jpg"
"85WVpofrCFk","How Are Ghost Particles Affecting Earth? | IceCube Observatory Discovery","828765","26037","2024-08-26T17:29:01Z","astrum, astronomy, space, neutrino, particle physics, subatomic particles, atoms, quantum physics, physics, icecube observatory, observatory, particle detectors, high energy neutrinos, electrons, nuclear fusion, South Pole, Antarctica, leptons, blackholes, supernova, photons, supermassive blackholes, Cherenkov radiation, muon, ghost particle, Digital Optical Modules, cosmic rays","How does this underground IceCube Observatory reveal the secrets of distant supernovae and blackholes?   Astrum Podcast: https://www.buzzsprout.com/2250635/share Displate Posters: https://astrumspace.info/Displates Astrum Merch! https://astrum-shop.fourthwall.com/ Join us on the Astrum discord: https://discord.gg/TKw8Hpvtv8  A huge thanks to our Patreons who help make these videos possible. Sign-up here: https://bit.ly/4aiJZNF  SUBSCRIBE for more videos about space and astronomy.  Subscribe! http://goo.gl/WX4iMN Facebook! http://goo.gl/uaOlWW Twitter! http://goo.gl/VCfejs  Astrum Spanish: https://www.youtube.com/@astrumespanol Astrum Portuguese: https://www.youtube.com/channel/UChn_-OwvV63mr1yeUGvH-BQ  Credits Writer: Callum Griffith Editor: Pavel Allsi Thumbnail Designer: Peter Sheppard Producer: Alex McColgan / Raquel Taylor   NASA/ESO/ESA   #astrum #observatory #space #neutrino #astronomy","https://i.ytimg.com/vi/85WVpofrCFk/maxresdefault.jpg"
"DhLm_4pBrso","What They Didn't Teach You in School about Neptune | Our Solar System's Planets","1547883","33731","2024-08-22T20:35:09Z","astrum, space, astronomy, neptune, solar system, planets, gas giants, Voyager 2, Uranus, triton, pluto, planetary rings, Earth, space probe, Sun, Mars, methane gas, stratosphere, troposphere, exosphere, Great dark spot, Voyager, hubble, NASA, small dark spot, magnetosphere, galle ring, lassell ring, Le verrier, Adams ring, Neptune's moons, moon, proteus, asteroids, psamathe, netho, jupiter","Everything you could want to know about Neptune. A refresh of the Astrum ‘Our Solar System’ series, updated to reflect all we’ve learned about our planetary neighbourhood in the last few years. Compare news coverage. Spot media bias. Avoid algorithms. Try Ground News today and get 40% off your subscription by going to https://ground.news/astrum  Astrum Podcast: https://www.buzzsprout.com/2250635/share Displate Posters: https://astrumspace.info/Displates Astrum Merch! https://astrum-shop.fourthwall.com/ Join us on the Astrum discord: https://discord.gg/TKw8Hpvtv8  A huge thanks to our Patreons who help make these videos possible. Sign-up here: https://bit.ly/4aiJZNF  SUBSCRIBE for more videos about space and astronomy.  Subscribe! http://goo.gl/WX4iMN Facebook! http://goo.gl/uaOlWW Twitter! http://goo.gl/VCfejs  Astrum Spanish: https://www.youtube.com/@astrumespanol Astrum Portuguese: https://www.youtube.com/channel/UChn_-OwvV63mr1yeUGvH-BQ  Credits Writer: Jon McColgan Editor: Felix Dennis / Nathalia Gardin Thumbnail Designer: Peter Sheppard Producer: Alex McColgan / Raquel Taylor   NASA/ESO/ESA   #astrum #neptune #solarsystem #solarsystemplanets #space #planets #hubble","https://i.ytimg.com/vi/DhLm_4pBrso/maxresdefault.jpg"
"UyzBoUvN3PM","What Voyager Detected at the Edge of the Solar System","5928267","77872","2024-08-19T17:30:04Z","astrum, space, voyager mission, voyager, voyager 1, voyager 2, nasa, solar system, astronomy, physics, technology, space technology, space mission, Earth, Neptune, uranus, saturn, jupiter, pluto","A Supercut Astrum Episode Covering the Voyager Mission. A huge thanks to our Patreons who help make these videos possible. Sign-up here: https://bit.ly/4aiJZNF  Astrum Podcast: https://www.buzzsprout.com/2250635/share Displate Posters: https://astrumspace.info/Displates Astrum Merch! https://astrum-shop.fourthwall.com/ Join us on the Astrum discord: https://discord.gg/TKw8Hpvtv8  SUBSCRIBE for more videos about space and astronomy.  Subscribe! http://goo.gl/WX4iMN Facebook! http://goo.gl/uaOlWW Twitter! http://goo.gl/VCfejs  Astrum Spanish: https://www.youtube.com/@astrumespanol Astrum Portuguese: https://www.youtube.com/channel/UChn_-OwvV63mr1yeUGvH-BQ  Credits Writer: Jon McColgan Editor: Nathalia Gardin Thumbnail Designer: Peter Sheppard Producer: Alex McColgan / Raquel Taylor   NASA/ESO/ESA   #Astrum #astronomy #astrophysics #physics #voyager #NASA #solar system","https://i.ytimg.com/vi/UyzBoUvN3PM/maxresdefault.jpg"
"dDc6UH7EEe0","The Star Explosion So Powerful, It Compressed Our Atmosphere from 2 Billion Light Years Away","951967","20060","2024-08-15T15:28:53Z","Astrum, astrumspace, Astronomy, astrophysics, physics, space, science, documentary, science documentary, NASA, ESA, ESO, Gamma Ray, gamma ray burst, gamma rays, GRB, gold, B.O.A.T, BOAT, kilonova, neutron star, black hole, blackhole, earth, soviet nuclear test, observable universe, sagittarius, JWST, James Webb, supernova, magnitude, explosion, jets, light, LHAASO, Observatory, solar flare, background radiation, axion, stellar, nucleosynthesis, heavy elements, meteorites, hydrogen, helium, lithium, big bang","The Brightest Explosion of All Time (B.O.A.T) could explain how the universe's heavy elements are formed.   ▀▀▀▀▀▀  NEW CHANNEL Astrum Earth: http://www.youtube.com/@AstrumEarth   ▀▀▀▀▀▀  Astrum Podcast: https://www.buzzsprout.com/2250635/share Astrum Infographic Artwork: https://electrify.art/collections/astrum  Astrum Displate Posters: https://astrumspace.info/Displates  Astrum Merch: https://astrum-shop.fourthwall.com/  Join us on the Astrum discord: https://discord.gg/TKw8Hpvtv8   SUBSCRIBE for more videos about space and astronomy.  Subscribe! http://goo.gl/WX4iMN  Facebook! http://goo.gl/uaOlWW  Twitter! http://goo.gl/VCfejs   A huge thanks to our Patreons who help make these videos possible. Sign-up here: https://bit.ly/4aiJZNF   Astrum Spanish: https://www.youtube.com/@astrumespanol  Astrum Portuguese: https://www.youtube.com/channel/UChn_-OwvV63mr1yeUGvH-BQ   ▀▀▀▀▀▀  Credits Writer: Julia Masselos Editor: Frame Forge Thumbnail Designer: Peter Sheppard Executive Producer: Raquel Taylor Creator of Astrum: Alex McColgan  With special thanks to: NASA/ESO/ESA   ▀▀▀▀▀▀  #Astrum #astronomy #astrophysics #physics #cosmology","https://i.ytimg.com/vi/dDc6UH7EEe0/maxresdefault.jpg"
"C3hBF3Gbj8Y","Meet LUCA - The Bizarre First Living Organism on Earth","298839","10916","2024-08-01T16:22:57Z","Astrum, astronomy, space, universe, earth, planets, solar systems, stars, astrobiology, chemistry, pale blue dot, Darwin, NASA, evolution, entropy, themodynamics, first law of thermodynamics, second law of thermodynamics, amino acids, nucleotides, fatty acids, liposome, quantum mechanics, DNA, RNA, the central dogma, LUCA, The Last Universal Common Ancestor, natural selection, complex enzyme, autocatalytic, life on earth, methanogen, thermodynamics","Astrum looks into the chemistry needed for life to begin.  Let BetterHelp connect you to a therapist who can support you - all from the comfort of your own home. Visit https://betterhelp.com/astrum and enjoy a special discount on your first month.   If you have any questions about the brand relating to how the therapists are credentialed, their privacy policy, or therapist compensation model, check out this FAQ: https://www.betterhelp.com/your-questions-answered/  Astrum Podcast: https://www.buzzsprout.com/2250635/share Displate Posters: https://astrumspace.info/Displates Astrum Merch! https://astrum-shop.fourthwall.com/ Join us on the Astrum discord: https://discord.gg/TKw8Hpvtv8  SUBSCRIBE for more videos about space and astronomy.  Subscribe! http://goo.gl/WX4iMN Facebook! http://goo.gl/uaOlWW Twitter! http://goo.gl/VCfejs  Astrum Spanish: https://www.youtube.com/@astrumespanol Astrum Portuguese: https://www.youtube.com/channel/UChn_-OwvV63mr1yeUGvH-BQ  A huge thanks to our Patreons who help make these videos possible. Sign-up here: https://bit.ly/4aiJZNF  Credits Writer: Chris Bartlett Editor: Nathália Gardin Thumbnail Designer: Peter Sheppard Producer: Alex McColgan / Raquel Taylor   NASA/ESO/ESA   #Astrum #Astronomy #life #universe #earth #chemistry","https://i.ytimg.com/vi/C3hBF3Gbj8Y/maxresdefault.jpg"
"DSwXdGeuFQg","You guys are awesome, thanks for the 2 million subs","24457","2903","2024-07-31T21:44:04Z","astrum, astronomy, space, astrophysics, NASA, solar system, planets, Sun, Moon, Stars, climate change, 4K, pluto, black holes, James Webb, JWST, hubble, universe, quantum physics, physics, 2 Million Subscribers, arrokoth, dwarf planet","A Special Episode to Thank Our 2 Million Subscribers! And it's not too late to become an astrumnaut and helping us on our mission to make ""Space for Everyone"" to join head over to Patreon https://bit.ly/4aiJZNF  Astrum Podcast: https://www.buzzsprout.com/2250635/share Displate Posters: https://astrumspace.info/Displates Astrum Merch! https://astrum-shop.fourthwall.com/ Join us on the Astrum discord: https://discord.gg/TKw8Hpvtv8  SUBSCRIBE for more videos about space and astronomy.  Subscribe! http://goo.gl/WX4iMN Facebook! http://goo.gl/uaOlWW Twitter! http://goo.gl/VCfejs  Astrum Spanish: https://www.youtube.com/@astrumespanol Astrum Portuguese: https://www.youtube.com/channel/UChn_-OwvV63mr1yeUGvH-BQ  Visit our Patreon to donate. Patreon: https://bit.ly/4aiJZNF  Credits Writer: Alex McColgan & Jon McColgan Editor: James Horsley  Thumbnail Designer: Peter Sheppard Producer: Alex McColgan/ Raquel Taylor   NASA/ESO/ESA   #Astrum #Astronomy #Space #physics #astrophysics  #2milionsubscriber","https://i.ytimg.com/vi/DSwXdGeuFQg/maxresdefault.jpg"
"Cp51BYfV5Sc","Mars Is Doing Something Weird at Night","958046","19875","2024-07-25T16:23:35Z","astrum, astronomy, physics, space, solar sytem, mars, martain surface, planets, Mars Rover, Life on Mars, NASA, Perseverance, jezero crater, biosphere, methane, aliens, alien life, Martains, Earth, solar radiation, planetary science, mars mission, astrobiology, Lake Vostok, DNA, Fossils, bacteria, Exo Mars","Astrum looks at the Martian locations most likely to harbour life. Use https://imprintapp.com/Astrum_LIB_2 to sign-up for Imprint’s 7-day free trial and get 20% off Imprint’s annual premium subscription.  A huge thanks to our Patreons who help make these videos possible. It’s not too late to become one of the first 1000 Astrumnauts - Sign-up here: https://bit.ly/4aiJZNF  Get you Displate Posters Here: https://astrumspace.info/Displates Astrum Podcast: https://www.buzzsprout.com/2250635/share Astrum Merch! https://astrum-shop.fourthwall.com/ Join us on the Astrum discord: https://discord.gg/TKw8Hpvtv8  SUBSCRIBE for more videos about space and astronomy.  Subscribe! http://goo.gl/WX4iMN Facebook! http://goo.gl/uaOlWW Twitter! http://goo.gl/VCfejs  Astrum Spanish: https://www.youtube.com/@astrumespanol Astrum Portuguese: https://www.youtube.com/channel/UChn_-OwvV63mr1yeUGvH-BQ  Credits Writer: Jon McColgan Editor: Pavel Allsi Thumbnail Designer: Peter Sheppard Producer: Alex McColgan / Raquel Taylor   NASA/ESO/ESA   #Astrum #Astronomy #Science #Space #Stars #Mars #Alienlife #solarsystem","https://i.ytimg.com/vi/Cp51BYfV5Sc/maxresdefault.jpg"
"lUYNQDAa3cI","Physics Gets Weird at the End of the Universe","1121554","25736","2024-07-22T17:18:04Z","astrum, astronomy, astrophysics, dark energy, dark matter, space, universe, cosmology, black holes, big rip, big freeze, heat death, big bang, big bounce, big crunch, cosmologists, expanding universe, matter, higgs field, quantum physics, stable vacuum, quantum tunnelling, milky way, second law of thermodynamics, entropy, CERN, event horizon, cosmic anti-friction","Astrum looks into the theories surround the end of the our universe. A huge thanks to our Patreons who help make these videos possible. It’s not too late to become one of the first 1000 Astrumnauts - Sign-up here: https://bit.ly/4aiJZNF  Astrum Podcast: https://www.buzzsprout.com/2250635/share Astrum Merch! https://astrum-shop.fourthwall.com/ Join us on the Astrum discord: https://discord.gg/TKw8Hpvtv8  SUBSCRIBE for more videos about space and astronomy.  Subscribe! http://goo.gl/WX4iMN Facebook! http://goo.gl/uaOlWW Twitter! http://goo.gl/VCfejs  Astrum Spanish: https://www.youtube.com/@astrumespanol Astrum Portuguese: https://www.youtube.com/channel/UChn_-OwvV63mr1yeUGvH-BQ  Visit our Patreon to donate. Patreon: https://bit.ly/4aiJZNF  Credits Writer: David Shlivko Editor: Frame Forge Thumbnail Designer: Peter Sheppard Producer: Alex McColgan/ Raquel Taylor   NASA/ESO/ESA   #Astrum #Astronomy #Space #physics #universe #darkmatter","https://i.ytimg.com/vi/lUYNQDAa3cI/maxresdefault.jpg"
"mrYjJ9Jl9dA","What They Didn't Teach You in School About Earth | Our Solar System's Planets","408405","15123","2024-07-11T20:00:51Z","Astrum, Astronomy, solar system, milky way, galaxy, Earth, surface ocean, magnetic field, life on Earth, Eratosthenes, heliocentric model, Earth's orbit, leap year, axial tilt, seasons, Earth's atmosphere, water cycle, plate tectonics, Earth's core, aurora, Earth's Moon, ocean tides, beauty of Earth, space exploration, planet Earth, Earth facts, unique planet, astronomical observations, Earth's geology, natural phenomena, astronomy","Check out Manta Sleep here https://tinyurl.com/3amtx2k3 and make sure to use ASTRUM for 10% off your order! ▀▀▀▀▀▀ Everything you ever wanted to know about earth, all in one place.   ▀▀▀▀▀▀  Astrum Podcast: https://www.buzzsprout.com/2250635/share Astrum Infographic Artwork: https://electrify.art/collections/astrum  Astrum Displate Posters: https://astrumspace.info/Displates  Astrum Merch: https://astrum-shop.fourthwall.com/  Join us on the Astrum discord: https://discord.gg/TKw8Hpvtv8   SUBSCRIBE for more videos about space and astronomy.  Subscribe! http://goo.gl/WX4iMN  Facebook! http://goo.gl/uaOlWW  Twitter! http://goo.gl/VCfejs   A huge thanks to our Patreons who help make these videos possible. Sign-up here: https://bit.ly/4aiJZNF   Astrum Earth: http://www.youtube.com/@AstrumEarth Astrum Spanish: https://www.youtube.com/@astrumespanol  Astrum Portuguese: https://www.youtube.com/channel/UChn_-OwvV63mr1yeUGvH-BQ   ▀▀▀▀▀▀  Credits Writer: Jon McColgan Editor: Nikolai Shishkin Thumbnail Designer: Peter Sheppard Producer: Alex McColgan/ Raquel Taylor   NASA/ESO/ESA   #Astrum #Astronomy #Space #Earth #oursolarsystem #planets","https://i.ytimg.com/vi/mrYjJ9Jl9dA/maxresdefault.jpg"
"wFTGP7-n3J8","What They Didn't Teach You in School About Mars | Our Solar System's Planets 4K","960114","24265","2024-07-08T17:44:42Z","Astrum, astronomy, astrophysics, cosmology, space, physics, planets, solar system, stars, mars, red planet, sun, NASA, ESA, Mission to Mars, Mars Rover, 4K, Rover, ice caps, Earth, gravity, volcano, vesta asteroid, Olympus Mons, Mount Everest, Valles Marineris, Grand Canyon, Opportunity, perseverance, Viking 1, spirit, Viking 2, Exo Mars, orbiter, Mars moons, phobos, deimos, moon","Everything you could want to know about Mars. A refresh of the Astrum ‘Our Solar System’ series, updated to reflect all we’ve learned about our planetary neighbourhood in the last few years.   A huge thanks to our Patreons who help make these videos possible. It’s not too late to become one of the first 1000 Astrumnauts - Sign-up here: https://bit.ly/4aiJZNF  Astrum Podcast: https://www.buzzsprout.com/2250635/share Displate Posters: https://displate.com/promo/astrum?art=5f04759ac338b  Astrum Merch! https://astrum-shop.fourthwall.com/ Join us on the Astrum discord: https://discord.gg/TKw8Hpvtv8  SUBSCRIBE for more videos about space and astronomy.  Subscribe! http://goo.gl/WX4iMN Facebook! http://goo.gl/uaOlWW Twitter! http://goo.gl/VCfejs  Astrum Spanish: https://www.youtube.com/@astrumespanol Astrum Portuguese: https://www.youtube.com/channel/UChn_-OwvV63mr1yeUGvH-BQ  Visit our Patreon to donate. Patreon: https://bit.ly/4aiJZNF  Credits Writer: Alex McColgan & Jon McColgan Editor: Nathalia Gardin Thumbnail Designer: Peter Sheppard Producer: Alex McColgan/ Raquel Taylor   #Astrum #Astronomy #Space #Mars #oursolarsystem #planets","https://i.ytimg.com/vi/wFTGP7-n3J8/maxresdefault.jpg"
